id,Job_title,Company,Category,Location,Work_type,Working_type,Salary,Experience,Skills,Study_requirement,Desc,Link,Link_img
gl439,Sales Executive,TURU - The Sleep Company®,Sales Strategy,"Cipondoh, Tangerang, Banten, Indonesia",Penuh Waktu,Tidak ditampilkan,Rp5jt-Rp7jt,1 – 3 tahun,"Strategi Penjualan, Penjualan dan Pemasaran, Manajemen Penjualan",Sarjana (S1),"Mengatur dan melakukan kunjungan penjualan, Membuat proposal terperinci dan materi untuk presentasi kepada klien, Menawarkan kepada klien tentang layanan dan penawaran perusahaan, Mampu menjaga hubungan baik dengan klien, Menyarankan peluang baru dan solusi, Bekerja sama dengan tim Pemasaran untuk menyusun proposal, Memberikan tanggapan yang cepat terhadap pertanyaan atau penyelesaian keluhan klien, Mencapai target penjualan, Mengelola catatan aktivitas penjualan dan menyusun laporan penjualan, Mampu menjaga citra, reputasi dan nama baik perusahaan.",https://glints.com/id/opportunities/jobs/sales-executive/3144a1d7-5fa4-4680-8fb9-556b82f71a3b?utm_referrer=explore,https://images.glints.com/unsafe/glints-dashboard.s3.amazonaws.com/company-logo/7520338e2edb818bfca2fd242fb3c2aa.png;
gl440,Koki (Cook),Warung Bumi Ayu (WBA),Positive Attitude,"Denpasar Selatan, Denpasar, Bali, Indonesia",Penuh Waktu,Tidak ditampilkan,Tidak ditampilkan,1 – 3 tahun,"Memasak, Kerja Tim, Perhatian terhadap Detail, Sikap Positif, Layanan Klien",SMA/SMK,"Usia maksimal 26 tahun, Laki-laki/Perempuan, Berpengalaman di bidangnya, Mampu bekerja dalam tim/individu, Berdomisili di Denpasar dan sekitarnya, Lokasi kerja di Denpasar",https://glints.com/id/opportunities/jobs/koki-cook/1386ba73-58d3-4a4e-a474-0991b9164d7f?utm_referrer=explore,https://images.glints.com/unsafe/glints-dashboard.s3.amazonaws.com/company-logo/8810e292232bd8af8c2298065ddd2c43.png;
gl441,FIELD TRAINER,PT. Global Jet Cargo,Training Delivery,"Ngaliyan, Semarang, Jawa Tengah, Indonesia",Penuh Waktu,Tidak ditampilkan,Tidak ditampilkan,1 – 3 tahun,Tidak ditampilkan,Sarjana (S1),,https://glints.com/id/opportunities/jobs/field-trainer/2d326871-1721-43db-b503-ca8531633007?utm_referrer=explore,https://images.glints.com/unsafe/glints-dashboard.s3.amazonaws.com/company-logo/431d38f306109448da0d1f70f69b13c1.png;
gl442,KYC Internship,Myrobin,Microsoft Excel,"Kapanewon Banguntapan, Bantul, DI Yogyakarta, Indonesia",Magang,Tidak ditampilkan,Rp2jt-Rp2jt,Kurang dari setahun,"Data Entry, Microsoft Excel, Google Sheets",Sarjana (S1),,https://glints.com/id/opportunities/jobs/kyc-internship/08725b81-6d8b-404a-acff-ca1b1e2adaf2?utm_referrer=explore,https://images.glints.com/unsafe/glints-dashboard.s3.amazonaws.com/company-logo/1afae53d8cc278ea189a50dda3436207.png;
gl443,Sales Force,PT. Global Sarana Sukses Balinusra,Community Engagement,"Kalipuro, Banyuwangi, Jawa Timur, Indonesia",Penuh Waktu,Tidak ditampilkan,"Rp2,6jt-Rp3,5jt",1 – 3 tahun,"Keterlibatan Komunitas, Kerja Tim, Komunikasi Interpersonal",SMA/SMK,,https://glints.com/id/opportunities/jobs/sales-force/0fff867b-08be-4b34-a53e-ba590ff3a163?utm_referrer=explore,https://images.glints.com/unsafe/glints-dashboard.s3.amazonaws.com/company-logo/f3fb049a2bcb7ccdc1241022a1653760.jpg;
gl444,Host Live Streaming,PT Bisnis Bersama Karunia,Sales and Marketing,"Curug, Tangerang, Banten, Indonesia",Kontrak,Tidak ditampilkan,Tidak ditampilkan,1 – 3 tahun,"Komunikasi Pemasaran, Penjualan dan Pemasaran, Penjualan B2C",SMA/SMK,,https://glints.com/id/opportunities/jobs/host-live-streaming/b04b5d7e-05e0-4121-a963-8f4ac72fa4f1?utm_referrer=explore,https://images.glints.com/unsafe/glints-dashboard.s3.amazonaws.com/company-logo/2b523fff21b5f814800317e64715cd60.png;
gl445,Asst Sales Manager,Squeeze Bali,Sales Strategy,"Denpasar Selatan, Denpasar, Bali, Indonesia",Penuh Waktu,Tidak ditampilkan,Tidak ditampilkan,1 – 3 tahun,"Analisis Penjualan, Strategi Penjualan, Penjualan dan Pemasaran",Sarjana (S1),,https://glints.com/id/opportunities/jobs/asst-sales-manager/4523300a-6a2c-4bd1-b6ea-3c3716295131?utm_referrer=explore,https://images.glints.com/unsafe/glints-dashboard.s3.amazonaws.com/company-logo/84b6779e52e14b72424785f32f2e1a81.png;
gl446,KOORDINATOR TOKO,PT Clandys Sukses Abadi,Leadership,"Kemantren Umbulharjo, Yogyakarta, DI Yogyakarta, Indonesia",Penuh Waktu,Tidak ditampilkan,"Rp2,3jt-Rp2,6jt",1 – 3 tahun,Tidak ditampilkan,Diploma (D1 - D4),,https://glints.com/id/opportunities/jobs/koordinator-toko/e01e0fd5-7649-435a-9948-71714c6985b1?utm_referrer=explore,https://images.glints.com/unsafe/glints-dashboard.s3.amazonaws.com/company-logo/39c7148ad5a81af81ee98943dc9ef618.jpg;
gl447,Marketing Officer,PT. Tiga Selaras Suksesindo,Jujur Dan Pekerja Keras,"Gubeng, Surabaya, Jawa Timur, Indonesia",Penuh Waktu,Tidak ditampilkan,Tidak ditampilkan,1 – 3 tahun,Tidak ditampilkan,Sarjana (S1),"Pria/Wanita maksimal 30 tahun, Minimal pendidikan S1/sederajat, Memiliki network yang luas, Memiliki pengalaman dibidang marketing jasa B2B minimal 1 tahun, Penampilan menarik, jujur,bertanggungjawab, memiliki motivasi tinggi, sanggup bekerja dengan target, dan dapat bekerja secara tim., Gaji pokok + insentif, Penempatan kantor pusat TSS Indonesia",https://glints.com/id/opportunities/jobs/marketing-officer/c6cbd3a1-97e4-4784-a0cd-d9ce54a00ff4?utm_referrer=explore,https://images.glints.com/unsafe/glints-dashboard.s3.amazonaws.com/company-logo/40bd53d6c99f430190d2be5df3c9c3ef.jpg;
gl448,Kepala Produksi,Pt Arga Anggala Sentosa,Product Management,"Jatiuwung, Tangerang, Banten, Indonesia",Penuh Waktu,Tidak ditampilkan,Rp4jt-Rp6jt,1 – 3 tahun,"Manajemen Produk, Teknik Mekanik",Diploma (D1 - D4),,https://glints.com/id/opportunities/jobs/kepala-produksi/52195f99-d695-41cf-9150-05d27b8ffe65?utm_referrer=explore,https://images.glints.com/unsafe/glints-dashboard.s3.amazonaws.com/company-logo/654dacc7d90c25357804ee1b37cbd765.jpg;
gl449,DRIVER LOGISTIK,Squeeze Bali,Logistics Management,"Denpasar Selatan, Denpasar, Bali, Indonesia",Penuh Waktu,Tidak ditampilkan,Tidak ditampilkan,1 – 3 tahun,"Kerja Tim, Keterampilan Komunikasi, Manajemen Logistik",SMA/SMK,,https://glints.com/id/opportunities/jobs/driver-logistik/c575d27e-4f1e-4508-b53b-7df2338fda19?utm_referrer=explore,https://images.glints.com/unsafe/glints-dashboard.s3.amazonaws.com/company-logo/84b6779e52e14b72424785f32f2e1a81.png;
gl450,Staff Telemarketing,PT. Benings Glow Indonesia,Telecommunications,"Sungai Kunjang, Samarinda, Kalimantan Timur, Indonesia",Kontrak,Tidak ditampilkan,Tidak ditampilkan,Kurang dari setahun,"Komunikasi Pemasaran, Pemasaran Online, Telekomunikasi",Sarjana (S1),"Perempuan maksimal 30 tahun, Pendidikan terakhir S1 (semua jurusan), Memiliki pengalaman di bidang customer service/telemarketing (freshgraduate diperbolehkan), Mampu menawarkan dan memperkenalkan produk dengan baik, Mampu mengoperasikan komputer, Mampu bekerja di bawah tekanan dan target, Memiliki kemampuan follow up yang cekatan",https://glints.com/id/opportunities/jobs/staff-telemarketing/86143c0d-66f9-4ae9-8f18-875187509d7b?utm_referrer=explore,https://images.glints.com/unsafe/glints-dashboard.s3.amazonaws.com/company-logo/5fce0b00612ed8bcc5f9a9bc3367a2ea.png;
gl451,Mekanik Alat Berat dan Dump Truck,PT Nugroho Lestari,Komunikatif,"Rungkut, Surabaya, Jawa Timur, Indonesia",Penuh Waktu,Tidak ditampilkan,Tidak ditampilkan,1 – 3 tahun,Administrasi,SMA/SMK,,https://glints.com/id/opportunities/jobs/mekanik-alat-berat-dan-dump-truck/05890de0-934d-4e37-8ae4-195e44af6c60?utm_referrer=explore,https://images.glints.com/unsafe/glints-dashboard.s3.amazonaws.com/company-logo/e66acb3b1145631c85c413750d469148.png;
gl452,Staff Keuangan Proyek,PT Nugroho Lestari,Ms Office,"Ampibabo, Parigi Moutong, Sulawesi Tengah, Indonesia",Penuh Waktu,Tidak ditampilkan,Tidak ditampilkan,3 – 5 tahun,Negosiasi Pembelian,Sarjana (S1),"Laki-laki, Usia max 40 th, Lulusan S1 Ekonomi / Akutansi, Pengalaman sebagai Staff Keuangan Proyek min 3 tahun (Diutamakan), Jujur, teliti, komunikatif, gesit, cekatan, dan bertanggung jawab, Membuat laporan keuangan proyek, Menguasai program komputer min. MS Excel, Bersedia di tempatkan di lokasi proyek (Luar Jawa)",https://glints.com/id/opportunities/jobs/staff-keuangan-proyek/99f45e00-9ae8-4abd-898a-ad31b642fb11?utm_referrer=explore,https://images.glints.com/unsafe/glints-dashboard.s3.amazonaws.com/company-logo/e66acb3b1145631c85c413750d469148.png;
gl453,Staff Keuangan Proyek,PT Nugroho Lestari,Ms Excel,"Kema, Minahasa Utara, Sulawesi Utara, Indonesia",Kontrak,Tidak ditampilkan,"Rp3,5jt-Rp4,5jt",3 – 5 tahun,Negosiasi Pembelian,Sarjana (S1),,https://glints.com/id/opportunities/jobs/staff-keuangan-proyek/f8cc1e55-93af-4eab-9422-859c3bd1d9ad?utm_referrer=explore,https://images.glints.com/unsafe/glints-dashboard.s3.amazonaws.com/company-logo/e66acb3b1145631c85c413750d469148.png;
gl454,English Teacher for Children,Children Learning Chinese,Microsoft Office,"Kebon Jeruk, Jakarta Barat, DKI Jakarta, Indonesia",Penuh Waktu,Tidak ditampilkan,Tidak ditampilkan,1 – 3 tahun,"Mengajar Taman Kanak-kanak, Kerja Tim, Bahasa Inggris, Pengajaran, Microsoft Office",Diploma (D1 - D4),,https://glints.com/id/opportunities/jobs/english-teacher-for-children/68f58ba5-9cdf-4510-a2f4-33fff33e3e78?utm_referrer=explore,https://images.glints.com/unsafe/glints-dashboard.s3.amazonaws.com/company-logo/cc8e8e4a80fc3a32e4cbbf5707c6c3e0.png;
gl455,Full Stack Engineer,Kawan Kerja,Bootstrap,"Bandung Wetan, Bandung, Jawa Barat, Indonesia",Magang,Tidak ditampilkan,Tidak ditampilkan,Kurang dari setahun,"Bootstrap, Laravel, TailwindCSS",SMA/SMK,"Membangun perangkat lunak yang kuat dan dapat ditingkatkan dengan membuat fitur baru, melakukan debugging, dan mengoptimalkan aplikasi, Mengembangkan dan mengusulkan produk atau fitur baru dengan memantau industri, Membuat kode untuk mengembangkan aplikasi web fungsional di perangkat mobile dan desktop, Implementasi keamanan dan perlindungan data, Desain dan implementasi solusi penyimpanan data, Bekerja sama dengan desainer, manajer produk, dan administrator sistem untuk mengidentifikasi dan membangun fitur baru",https://glints.com/id/opportunities/jobs/full-stack-engineer/dbfe9446-eb69-4342-9359-02a4eb9b5f77?utm_referrer=explore,https://images.glints.com/unsafe/glints-dashboard.s3.amazonaws.com/company-logo/bd58195efce3e2357cfa83e6df9e7ae8.png;
gl456,OB/OFFICE BOY,Squeeze Bali,Hospitality Management,"Denpasar Selatan, Denpasar, Bali, Indonesia",Penuh Waktu,Tidak ditampilkan,Tidak ditampilkan,1 – 3 tahun,"Kerja Tim, Manajemen Hospitalitas, Keterampilan Komunikasi",SMA/SMK,,https://glints.com/id/opportunities/jobs/ob-office-boy/9940c0b9-4cb1-4530-b6ca-d0836c229fda?utm_referrer=explore,https://images.glints.com/unsafe/glints-dashboard.s3.amazonaws.com/company-logo/84b6779e52e14b72424785f32f2e1a81.png;
gl457,Tax Accountant (Based in Medan),Topremit,Accounting,"Medan Kota, Medan, Sumatera Utara, Indonesia",Penuh Waktu,Tidak ditampilkan,Tidak ditampilkan,1 – 3 tahun,"Microsoft Excel, Akuntansi, Pajak Penghasilan, Perencanaan Pajak",Sarjana (S1),"Willing to stay in Medan, Min. 2 years of experience in Accounting, Bachelor's degree in Accounting or related field., Understanding of mathematics and accounting along with financial processes., Has advanced MS Excel skills including Vlookup and pivot tables, Experience with general ledger functions and the month-end/year-end close process, Good understanding in English, Strong analytical, communication, and computer skills., Skilled in Accounting knowledge, Tax (Brevet A/B), etc, Have competiencies such as Tax Regulation and Procedures, e-SPT, Tax Calculation",https://glints.com/id/opportunities/jobs/tax-accountant-based-in-medan/24fbe96b-3a37-445a-981a-de8dc96f022e?utm_referrer=explore,https://images.glints.com/unsafe/glints-dashboard.s3.amazonaws.com/company-logo/e614e65e78bfefca817b6def79fa7602.png;
gl458,AR/ACCOUNT RECEIVABLE,Squeeze Bali,Microsoft Office,"Denpasar Selatan, Denpasar, Bali, Indonesia",Penuh Waktu,Tidak ditampilkan,Tidak ditampilkan,Kurang dari setahun,"Piutang Usaha, Akuntansi, Microsoft Office",Diploma (D1 - D4),,https://glints.com/id/opportunities/jobs/ar-account-receivable/383426a3-d276-41da-aa99-f391cd0ba345?utm_referrer=explore,https://images.glints.com/unsafe/glints-dashboard.s3.amazonaws.com/company-logo/84b6779e52e14b72424785f32f2e1a81.png;
gl459,Beauty Advisor (Makassar),PT NRI Global Mandiri (Nature Republic Indonesia),Microsoft Office,"Makassar, Makassar, Sulawesi Selatan, Indonesia",Penuh Waktu,Tidak ditampilkan,"Rp3jt-Rp3,5jt",Kurang dari setahun,"Microsoft Excel, Kemampuan Komunikasi, Microsoft Office",SMA/SMK,,https://glints.com/id/opportunities/jobs/beauty-advisor-makassar/1608ff7f-de67-41ca-a234-8e75f94541e2?utm_referrer=explore,https://images.glints.com/unsafe/glints-dashboard.s3.amazonaws.com/company-logo/a999141de66194ccab1b61d44fc636a0.jpg;
gl460,Concept Artist,LZY Visual,Creative Design,"Rungkut, Surabaya, Jawa Timur, Indonesia",Penuh Waktu,Tidak ditampilkan,Tidak ditampilkan,1 – 3 tahun,"Desain Kreatif, Design Thinking, Seni Konsep",Diploma (D1 - D4),,https://glints.com/id/opportunities/jobs/concept-artist/36243218-5c5e-4ad0-8289-1506ec97c216?utm_referrer=explore,https://images.glints.com/unsafe/glints-dashboard.s3.amazonaws.com/company-logo/4dc60706f4f17b535e3db4ef90b5df10.png;
gl461,Head Of Finance,Squeeze Bali,Corporate Finance,"Denpasar Selatan, Denpasar, Bali, Indonesia",Penuh Waktu,Tidak ditampilkan,Tidak ditampilkan,Kurang dari setahun,"Keuangan Manajerial, Keuangan Perusahaan, Akuntansi",Diploma (D1 - D4),,https://glints.com/id/opportunities/jobs/head-of-finance/d0b662ef-4791-48f4-8781-f549be5668b7?utm_referrer=explore,https://images.glints.com/unsafe/glints-dashboard.s3.amazonaws.com/company-logo/84b6779e52e14b72424785f32f2e1a81.png;
gl462,SALES REPRESENTATIVE,PT Satriakarya Adiyudha,Strong Communication Skills,"Tamalanrea, Makassar, Sulawesi Selatan, Indonesia",Penuh Waktu,Tidak ditampilkan,"Rp3,5jt-Rp3,6jt",3 – 5 tahun,"Penjualan B2C, Keterampilan Negosiasi, Keterampilan Komunikasi",SMA/SMK,,https://glints.com/id/opportunities/jobs/sales-representative/12d4f1be-02fa-40ab-8796-b15f8f43c6fb?utm_referrer=explore,https://images.glints.com/unsafe/glints-dashboard.s3.amazonaws.com/company-logo/cd222ce27a83add084e8d98d969f340e.jpg;
gl463,Sales Horeca Hotel Restaurant and Cafe,PT Buwana Mitra Semesta,Siap bekerja secara mobile,"Pademangan, Jakarta Utara, DKI Jakarta, Indonesia",Penuh Waktu,Tidak ditampilkan,Tidak ditampilkan,1 – 3 tahun,Tidak ditampilkan,SMA/SMK,"Minimal lulusan D3 atau S1, Usia minimal 31 tahun, Memiliki pengalaman Marketing minimal 1 tahun, Pengalaman di bidang Food service minimal 2 tahun nilai tambah, Menyukai dunia kuliner, Tidak memiliki suatu larangan makanan dan minuman, Lancar berkomunikasi, memiliki kemampuan negosiasi yang baik, Dapat bekerja secara tim maupun individu, Dapat bekerja di bawah tekanan, Siap bekerja secara mobile, Siap bekerja 6 hari, Siap ditempatkan di Gunung Sahari Jakarta Utara",https://glints.com/id/opportunities/jobs/sales-horeca-hotel-restaurant-and-cafe/32d79487-d491-4ec7-9eea-2b5eb8afefd2?utm_referrer=explore,https://images.glints.com/unsafe/glints-dashboard.s3.amazonaws.com/company-logo/add866f2015ef34e9338033efdcf44bc.png;
gl464,Field Sales (Pekanbaru dan Medan),PT.  XENA PRANADIPA DHIA CAKRA,Sales Strategy,"Payung Sekaki, Pekanbaru, Riau, Indonesia",Penuh Waktu,Tidak ditampilkan,Tidak ditampilkan,1 – 3 tahun,"Komunikasi Pemasaran, Strategi Penjualan, Keterampilan Negosiasi, Keterampilan Presentasi",SMA/SMK,"Min SMA/K sederajat, Berpengalaman di bidang yang sama, dibidang sales cargo lebih disukai, Menyukai tantangan dan berorientasi pada target, Memiliki kendaraan pribadi dan SIM yang sesuai, Menguasai area Penempatan, Penempatan PEKANBARU dan MEDAN, Bersedia gabung secepatnya (ASAP)",https://glints.com/id/opportunities/jobs/field-sales-pekanbaru-dan-medan/e5a41502-56a5-4a53-9ca2-17ba872b7f3f?utm_referrer=explore,https://images.glints.com/unsafe/glints-dashboard.s3.amazonaws.com/company-logo/140cbc09a6148a78f02750d553791400.jpeg;
gl465,MEKANIK DIESEL,Squeeze Bali,Mechanical Engineering,"Denpasar Selatan, Denpasar, Bali, Indonesia",Penuh Waktu,Tidak ditampilkan,Tidak ditampilkan,1 – 3 tahun,"Mekanik, Kerja Tim, Teknik Mekanik",Diploma (D1 - D4),,https://glints.com/id/opportunities/jobs/mekanik-diesel/256ae3d2-786d-438b-b03d-1ac52439d0b7?utm_referrer=explore,https://images.glints.com/unsafe/glints-dashboard.s3.amazonaws.com/company-logo/84b6779e52e14b72424785f32f2e1a81.png;
gl466,Security Engineer,PT Kalos Anthrope Solusi,Cyber Security,"Tanah Abang, Jakarta Pusat, DKI Jakarta, Indonesia",Penuh Waktu,Tidak ditampilkan,"Rp5,5jt-Rp6,5jt",Kurang dari setahun,Tidak ditampilkan,Sarjana (S1),"Threat Monitoring, Threat Analysis and recommendation, Incident response, Manage device/SIEM configuration, Reporting",https://glints.com/id/opportunities/jobs/security-engineer/7b015530-d21e-4283-9a48-554a6e0eaf9f?utm_referrer=explore,https://images.glints.com/unsafe/glints-dashboard.s3.amazonaws.com/company-logo/e64e86ec4451687097741f9ec34dac0b.png;
gl467,Staff Telemarketing,BPR Prima Kredit Mandiri,Interpersonal Communication,"Tangerang, Tangerang, Banten, Indonesia",Penuh Waktu,Tidak ditampilkan,Tidak ditampilkan,1 – 3 tahun,"Keterampilan Negosiasi, Komunikasi Interpersonal, Analisis Pasar",Diploma (D1 - D4),"Menghubungi calon konsumen untuk menawarkan produk BPR melalui telepon, Mengumpulkan informasi  yang berhubungan dengan produk yang ditawarkan, Melakukan identifikasi mengenai semua kebutuhan dari pelanggan, Menghubungi calon debitur yang berpotensi untuk mengajukan kredit kembali ke BPR.",https://glints.com/id/opportunities/jobs/staff-telemarketing/aaa6d5aa-1032-449e-91f9-f3c0b7b2f142?utm_referrer=explore,https://images.glints.com/unsafe/glints-dashboard.s3.amazonaws.com/company-logo/0a7bf1232e1e0dfce0c2c73a86ae612b.jpg;
gl468,Quantity Surveyor,Pt Perdana Rancangbangun Utama (probuilder Group),Microsoft Office,"Tanjung Priok, Jakarta Utara, DKI Jakarta, Indonesia",Penuh Waktu,Tidak ditampilkan,Tidak ditampilkan,1 – 3 tahun,"Kerja Tim, AutoCAD, Microsoft Office, Keterampilan Komunikasi",Sarjana (S1),,https://glints.com/id/opportunities/jobs/quantity-surveyor/d14b8023-ddfd-470d-a635-ec9871a96f3b?utm_referrer=explore,https://images.glints.com/unsafe/glints-dashboard.s3.amazonaws.com/company-logo/27c38a0d06b255fe00fa19101675c711.jpg;
gl469,Sales Executive,PT. Mitra Bisnis Indojaya,Persuasive Selling,"Sawah Besar, Jakarta Pusat, DKI Jakarta, Indonesia",Penuh Waktu,Tidak ditampilkan,Tidak ditampilkan,1 – 3 tahun,Penjualan dan Pemasaran,SMA/SMK,"Berpenampilan menarik., Pendidikan minimal SMA/SMK, Min. 1 tahun pengalaman kerja., Mampu menggunakan Microsoft Office (Word, Excel, Powerpoint) dan Google., Memiliki kendaraan bermotor dan min. SIM C (valid), Membangun, Memelihara dan Memperluas basis pelanggan kami., Memiliki kemampuan komunikasi dan analisa yang baik., Mampu bekerja dengan target dan dibawah tekanan., Berorientasi pada hasil dan mampu bekerja baik secara mandiri maupun tim.",https://glints.com/id/opportunities/jobs/sales-executive/a6df3ae0-65f5-4228-a4ab-0a320d2715e0?utm_referrer=explore,https://images.glints.com/unsafe/glints-dashboard.s3.amazonaws.com/company-logo/ceeb63bcb8a42c1093c0888aec90b70d.png;
gl470,Course Consultant,Children Learning Chinese,Social Media Marketing,"Kebon Jeruk, Jakarta Barat, DKI Jakarta, Indonesia",Penuh Waktu,Tidak ditampilkan,Tidak ditampilkan,1 – 3 tahun,"Komunikasi Pemasaran, Digital Marketing, Penelitian Pasar, Jaringan Komputer, Strategi Pemasaran",Sarjana (S1),,https://glints.com/id/opportunities/jobs/course-consultant/c329c0de-adb6-4084-be1a-bb045fab733f?utm_referrer=explore,https://images.glints.com/unsafe/glints-dashboard.s3.amazonaws.com/company-logo/cc8e8e4a80fc3a32e4cbbf5707c6c3e0.png;
gl471,Host Live stream ecommerce,Ninfive,Positive Attitude,"Penjaringan, Jakarta Utara, DKI Jakarta, Indonesia",Paruh Waktu,Tidak ditampilkan,"Rp4,8jt-Rp6jt",1 – 3 tahun,"Perhatian terhadap Detail, Pembelajaran Mandiri, Sikap Positif",SMA/SMK,"Menghadirkan siaran langsung yang menarik dan menghibur kepada audiens., Berinteraksi secara aktif dengan audiens melalui chat dan komentar., Menyampaikan konten dengan jelas dan memikat menggunakan kemampuan berbicara yang baik., Memahami tren dan topik yang sedang populer untuk menarik minat audiens., Memastikan kelancaran teknis selama siaran langsung., Mempromosikan dan memperkenalkan produk atau layanan perusahaan kepada audiens.",https://glints.com/id/opportunities/jobs/host-live-stream-ecommerce/24c63be2-28db-43c9-b90c-bd2f9ccac989?utm_referrer=explore,https://images.glints.com/unsafe/glints-dashboard.s3.amazonaws.com/company-logo/8333d909b6f369152fee1d4f475b494b.jpeg;
gl472,Operator Sewing (Operator Mesin Jahit Tenda),Sumber Display Dunia,Teliti Dan Cekatan,"Cengkareng, Jakarta Barat, DKI Jakarta, Indonesia",Penuh Waktu,Tidak ditampilkan,Tidak ditampilkan,1 – 3 tahun,Tidak ditampilkan,SD,,https://glints.com/id/opportunities/jobs/operator-sewing-operator-mesin-jahit-tenda/046722f8-6c61-4a67-bb96-5a84e542d3a6?utm_referrer=explore,https://images.glints.com/unsafe/glints-dashboard.s3.amazonaws.com/company-logo/9b747e36fb9335547e9bc219851e3253.png;
gl473,Business Intelligence and Integration Technologist,PT Boon Software,Collaboration,"Kebon Jeruk, Jakarta Barat, DKI Jakarta, Indonesia",Penuh Waktu,Tidak ditampilkan,Tidak ditampilkan,1 – 3 tahun,"Interpersonal Skills, Pembelajaran Mandiri, Kolaborasi",Sarjana (S1),,https://glints.com/id/opportunities/jobs/business-intelligence-and-integration-technologist/dfad8908-d8e9-40c2-9a8e-2466eda1afe1?utm_referrer=explore,https://images.glints.com/unsafe/glints-dashboard.s3.amazonaws.com/company-logo/f6ed02241636938ce91fcc28166ba183.png;
gl474,Customer Relation Management,PT Leika Management Studio (Leika Management),Strong Communication Skills,"Kapanewon Berbah, Sleman, DI Yogyakarta, Indonesia",Penuh Waktu,Tidak ditampilkan,"Rp2,2jt-Rp2,7jt",1 – 3 tahun,"Manajemen Pemasaran, Penjualan B2C, Berbicara di Depan Umum, Keterampilan Komunikasi",Sarjana (S1),,https://glints.com/id/opportunities/jobs/customer-relation-management/b42445dc-5cc1-4ae7-b73e-ca294b25310d?utm_referrer=explore,https://images.glints.com/unsafe/glints-dashboard.s3.amazonaws.com/company-logo/514bef0cceab4c641156656ced2a9500.png;
gl475,Mandarin Tutor,Chinese Grow,Language Teaching,"Kebayoran Lama, Jakarta Selatan, DKI Jakarta, Indonesia",Penuh Waktu,Tidak ditampilkan,Rp4jt-Rp7jt,Kurang dari setahun,"Mengajar Bahasa, Pengajaran, Bahasa Cina",SMA/SMK,"Offline classes: Jakarta Selatan, Pondok Indah Mall complex., Online classes: Conducted through Zoom application (flexible scheduling).

Job Descriptions:, Conduct engaging and fun classroom teaching for students., Demonstrate creativity in teaching methods., Participate in online training sessions organized by Chinese Grow., Conduct Mandarin language classes for students ranging from kindergarten to general proficiency levels., Offline teaching for 3 days a week （Tuesday, Thursday, and Saturday) and online teaching for 2 days, providing a balanced approach to language instruction.",https://glints.com/id/opportunities/jobs/mandarin-tutor/37e3b17a-eddc-49da-8cc8-f1d80284538c?utm_referrer=explore,https://images.glints.com/unsafe/glints-dashboard.s3.amazonaws.com/company-logo/e12ace6fb7f382cbfb0f72bfa67066cc.png;
gl476,Lowongan Junior Angular Programmer,PT Nextgen Inovasi Indonesia,Angular Materials,"Setiabudi, Jakarta Selatan, DKI Jakarta, Indonesia",Kontrak,Tidak ditampilkan,Rp5jt-Rp7jt,1 – 3 tahun,JavaScript,Diploma (D1 - D4),"Menguasai HTML, CSS, Ajax, Javascript dan framework Angular atau Angular Material, Mampu mengelola data JSON, API dan Web Service, Memiliki pengalaman minimal 1 tahun dalam menggunakan Angular atau Angular Material, Memiliki pemahaman logika yang kuat dan pemecahan masalah dengan baik, Dapat bekerja secara mandiri maupun berkolaborasi dengan tim, Memiliki sikap dan etos kerja yang baik dan dapat berkomunikasi dengan baik, responsif dan solutif",https://glints.com/id/opportunities/jobs/lowongan-junior-angular-programmer/cfcd46bc-3f50-4180-9b7f-f7de873381fb?utm_referrer=explore,https://images.glints.com/unsafe/glints-dashboard.s3.amazonaws.com/company-logo/a795596d828c5972409d174c24929e5f.jpg;
gl477,Client Executive Manager,PT Solusi Kreatif Universal,Product Management,"Bekasi Utara, Bekasi, Jawa Barat, Indonesia",Penuh Waktu,Tidak ditampilkan,Rp5jt-Rp7jt,1 – 3 tahun,"Manajemen Produk, Pemasaran Produk, Pengembangan Produk",Sarjana (S1),"Mahir berkomunikasi dengan client, Berkomunikasi dengan divisi lain memastikan project berjalan sesuai, Berinteraksi langsung dengan client dan tim internal",https://glints.com/id/opportunities/jobs/client-executive-manager/e8d30948-4b79-4418-883c-d03c18a9d7a2?utm_referrer=explore,https://images.glints.com/unsafe/glints-dashboard.s3.amazonaws.com/company-logo/6436118ea1d9b72b1238eb4cea267084.jpg;
gl478,Sales taking order,PT Fajar Surya Makmur Plastika,Salesforce,"Penjaringan, Jakarta Utara, DKI Jakarta, Indonesia",Penuh Waktu,Tidak ditampilkan,"Rp3,5jt-Rp4,5jt",1 – 3 tahun,"Salesforce, Manajemen Waktu, Keterampilan Komunikasi",SMA/SMK,"Mengatur dan melakukan kunjungan ke toko-toko, pasar tradisionil untuk mengorder barang sembako kepada pelanggan, Menawarkan barang sembako pada waktu kunjungan ke toko-toko, pasar tadisionil, Menjaga hubungan dengan pelanggan dengan memberikan dukungan informasi ketersediaan barang-sembako, Memberikan tanggapan yang cepat terhadap pertanyaan atau penyelesaian keluhan pelanggan, Membantu mencapai target penjualan, Menyiapkan catatan order penjualan dan menyerahkan kepada Administrasi penjualan",https://glints.com/id/opportunities/jobs/sales-taking-order/47a05b2c-1503-42ae-84cd-e8e600ebe2be?utm_referrer=explore,https://images.glints.com/unsafe/glints-dashboard.s3.amazonaws.com/company-logo/1901e41fe02d649d83142ddc6f3c3ccf.png;
