id,Job_title,Company,Category,Location,Work_type,Working_type,Salary,Experience,Skills,Study_requirement,Desc,Link,Link_img
gl616,Pengajar Fulltime Kimia (Edulab Pekanbaru),Edulab Indonesia,Interpersonal Skills,"Lima Puluh, Pekanbaru, Riau, Indonesia",Penuh Waktu,Tidak ditampilkan,"Rp3jt-Rp3,5jt",Kurang dari setahun,"Interpersonal Skills, Pengajaran, Keterampilan Komunikasi",Sarjana (S1),,https://glints.com/id/opportunities/jobs/pengajar-fulltime-kimia-edulab-pekanbaru/1214f082-aaa0-4da8-ae52-aae42e14ff8d?utm_referrer=explore,https://images.glints.com/unsafe/glints-dashboard.s3.amazonaws.com/company-logo/40f55547435c926834c3ebba84d46121.png;
gl617,Teknisi Mesin,Meditrust Indonesia,Machine Operator,"Pancoran, Jakarta Selatan, DKI Jakarta, Indonesia",Penuh Waktu,Tidak ditampilkan,Tidak ditampilkan,1 – 3 tahun,"Kemampuan Komunikasi, Operator Mesin, 3D Printing",SMA/SMK,"Pria dengan usia maks 35 thn, Pendidikan teknik elektro / teknik mesin, Diutamakan memiliki pengalaman kerja teknis di 3D Printing dan Milling Machine ( Mesin bubut) min 2 tahun, Penempatan Jakarta & Surabaya, Jujur, berdedikasi dan berintegritas, Memiliki kendaraan motor dan SIM C",https://glints.com/id/opportunities/jobs/teknisi-mesin/e5e44012-b6cf-4496-9a4b-5d749cd3a700?utm_referrer=explore,https://images.glints.com/unsafe/glints-dashboard.s3.amazonaws.com/company-logo/e9b2c51c0a1fdac460ed049b4006304a.png;
gl618,Supervisor electrical Engineering,PT Global Auto International,PCB Design,"Cilincing, Jakarta Utara, DKI Jakarta, Indonesia",Penuh Waktu,Tidak ditampilkan,Tidak ditampilkan,1 – 3 tahun,"Pengembangan Produk, Desain PCB, ISO 9001 2015",Diploma (D1 - D4),,https://glints.com/id/opportunities/jobs/supervisor-electrical-engineering/1608b30c-0b5e-4e54-9c56-758b055b5c42?utm_referrer=explore,https://images.glints.com/unsafe/glints-dashboard.s3.amazonaws.com/company-logo/c459cfa055563c3bff80981b18eabd9b.jpg;
gl619,Merchandiser,CV BALI BISA MANDIRI,Microsoft Office,"Kuta, Badung, Bali, Indonesia",Penuh Waktu,Tidak ditampilkan,Tidak ditampilkan,1 – 3 tahun,"Pelayanan Pelanggan, Desain Kreatif, Kemampuan Komunikasi, Microsoft Office, Negosiasi Pembelian",SMA/SMK,,https://glints.com/id/opportunities/jobs/merchandiser/fd53896c-28aa-4c09-b0cc-fa13a45d8f92?utm_referrer=explore,https://images.glints.com/unsafe/glints-dashboard.s3.amazonaws.com/company-logo/142b77a54711f6a00943ceb93c9c4170.png;
gl620,Teknisi CCTV /Cabling,PT Mitra Kerja Utama,Networking,"Kuta, Badung, Bali, Indonesia",Penuh Waktu,Tidak ditampilkan,"Rp4,8jt-Rp5jt",1 – 3 tahun,"Jaringan IP, LAN, Jaringan",SMA/SMK,,https://glints.com/id/opportunities/jobs/teknisi-cctv-cabling/78496153-8e42-4935-a192-cff1aa7cc417?utm_referrer=explore,https://images.glints.com/unsafe/glints-dashboard.s3.amazonaws.com/company-logo/712e2c5210fa4189372dc2dde406e85e.jpg;
gl621,Facility Service,Marvell City Mall,Facility Coordinator,"Wonokromo, Surabaya, Jawa Timur, Indonesia",Penuh Waktu,Tidak ditampilkan,Tidak ditampilkan,1 – 3 tahun,Tidak ditampilkan,Diploma (D1 - D4),"minimal D3/ S1 Semua jurusan, Pengalaman minimal 2 tahun sebagai Facility dalam bidang Building management, Keahlian dalam pengelolaan dan perencanaan Facility Management, Kemampuan analitis yang kuat dan pemahaman mengenai Infrastructure asset management, Pengalaman dalam menangani keluhan dan menjaga standar fasilitas",https://glints.com/id/opportunities/jobs/facility-service/bf931496-bce8-4986-b445-7a760e700fdf?utm_referrer=explore,https://images.glints.com/unsafe/glints-dashboard.s3.amazonaws.com/company-logo/70c5f5fc17840e33519089629422ee6e.png;
gl622,Japanese Tutor / Tutor Bahasa Jepang - Bandung (Full Time),CV. Kukche Mitra Sukses,Leadership,"Andir, Bandung, Jawa Barat, Indonesia",Penuh Waktu,Tidak ditampilkan,Tidak ditampilkan,1 – 3 tahun,Pengajaran,Diploma (D1 - D4),,https://glints.com/id/opportunities/jobs/japanese-tutor-tutor-bahasa-jepang-bandung-full-time/0afb8b72-3513-4b30-b152-a1a7eb3c65cc?utm_referrer=explore,https://images.glints.com/unsafe/glints-dashboard.s3.amazonaws.com/company-logo/37b0b94f925f35859e0ba04035443619.jpg;
gl623,Engineering Staff HVAC,Marvell City Mall,HVAC Controls,"Wonokromo, Surabaya, Jawa Timur, Indonesia",Penuh Waktu,Tidak ditampilkan,Tidak ditampilkan,1 – 3 tahun,Teknik Pemeliharaan,SMA/SMK,"Pria, Maks. 30 tahun, Pendidikan Min. SMK Jurusan mesin, Berpengalaman Min. 1 tahun, Memiliki motivasi dan semangat kerja yang tinggi dan proaktif, Disiplin, teliti dan mampu bekerja tim, Siap bekerja shift dan siap bergabung secepatnya",https://glints.com/id/opportunities/jobs/engineering-staff-hvac/3661648a-35b3-400e-91b6-705f7946faf3?utm_referrer=explore,https://images.glints.com/unsafe/glints-dashboard.s3.amazonaws.com/company-logo/70c5f5fc17840e33519089629422ee6e.png;
gl624,Korean Tutor / Pengajar Bahasa Korea - Jaksel (Full Time),CV. Kukche Mitra Sukses,Good Teaching Skill,"Kebayoran Lama, Jakarta Selatan, DKI Jakarta, Indonesia",Penuh Waktu,Tidak ditampilkan,Tidak ditampilkan,1 – 3 tahun,Pengajaran,Diploma (D1 - D4),,https://glints.com/id/opportunities/jobs/korean-tutor-pengajar-bahasa-korea-jaksel-full-time/80b09e56-0503-4832-8096-97ab55408523?utm_referrer=explore,https://images.glints.com/unsafe/glints-dashboard.s3.amazonaws.com/company-logo/37b0b94f925f35859e0ba04035443619.jpg;
gl625,Germany Tutor / Pengajar Bahasa Jerman - Jaksel Full / Part Time,CV. Kukche Mitra Sukses,Berkomunikasi Dengan Baik,"Kebayoran Lama, Jakarta Selatan, DKI Jakarta, Indonesia",Penuh Waktu,Tidak ditampilkan,Tidak ditampilkan,1 – 3 tahun,Tidak ditampilkan,Diploma (D1 - D4),"Mengajar bahasa Jerman untuk usia 6 tahun ke atas, Mengajar menggunakan kurikulum internasional, Membuat review perkembangan murid setiap bulan, Berusia minimal 17 tahun, Memiliki latar belakang Pendidikan Bahasa Jerman dan atau memiliki sertifikasi minimal B1 / B2, Berpengalaman mengajar minimal 1 tahun, Lulusan luar negeri nilai menjadi plus, Bersedia mengajar hingga program selesai, Posisi Full Time / Part Time.",https://glints.com/id/opportunities/jobs/germany-tutor-pengajar-bahasa-jerman-jaksel-full-part-time/2d49ad6d-e97f-4e2b-8959-29b9a3d3d9bc?utm_referrer=explore,https://images.glints.com/unsafe/glints-dashboard.s3.amazonaws.com/company-logo/37b0b94f925f35859e0ba04035443619.jpg;
gl626,Germany Tutor / Pengajar Bahasa Jerman - Jakut (Full Time),CV. Kukche Mitra Sukses,Memiliki Kemampuan Komunikasi Yang Baik,"Kelapa Gading, Jakarta Utara, DKI Jakarta, Indonesia",Penuh Waktu,Tidak ditampilkan,"Rp3,5jt-Rp4,5jt",1 – 3 tahun,Tidak ditampilkan,Sarjana (S1),"Mengajar bahasa Jerman untuk usia 6 tahun ke atas, Mengajar menggunakan kurikulum internasional, Membuat review perkembangan murid setiap bulan, Berusia minimal 17 tahun, Memiliki latar belakang Pendidikan Bahasa Jerman dan atau memiliki sertifikasi minimal B1 / B2, Berpengalaman mengajar minimal 1 tahun, Lulusan luar negeri nilai menjadi plus, Bersedia mengajar hingga program selesai.",https://glints.com/id/opportunities/jobs/germany-tutor-pengajar-bahasa-jerman-jakut-full-time/ed9d85b7-35ca-4816-a6d4-2cc8ffec7cdd?utm_referrer=explore,https://images.glints.com/unsafe/glints-dashboard.s3.amazonaws.com/company-logo/37b0b94f925f35859e0ba04035443619.jpg;
gl627,Pengajar Fulltime Biologi (Edulab Medan),Edulab Indonesia,Teaching,"Medan Polonia, Medan, Sumatera Utara, Indonesia",Penuh Waktu,Tidak ditampilkan,"Rp3jt-Rp3,5jt",Kurang dari setahun,"Kemampuan Komunikasi, Pengajaran, Keterampilan Komunikasi",Sarjana (S1),,https://glints.com/id/opportunities/jobs/pengajar-fulltime-biologi-edulab-medan/05015078-365f-42be-a77a-b8d0077d4333?utm_referrer=explore,https://images.glints.com/unsafe/glints-dashboard.s3.amazonaws.com/company-logo/40f55547435c926834c3ebba84d46121.png;
gl628,Mandarin Tutor / Pengajar Bahasa Mandarin - Jakut (Part Time),CV. Kukche Mitra Sukses,Fluent In Mandarin,"Kelapa Gading, Jakarta Utara, DKI Jakarta, Indonesia",Paruh Waktu,Tidak ditampilkan,"Rp3,5jt-Rp4,5jt",1 – 3 tahun,Tidak ditampilkan,Sarjana (S1),"Mempunyai kemampuan komunikasi yang baik., Berkomitmen dan mempunyai dedikasi tinggi dalam mengajar., Dapat bekerja sama dengan manajemen dalam pengarahan kurikulum dan teknis mengajar., Bersedia membuat konten untuk kebutuhan pembelajaran., Kreatif dalam metode mengajarkan materi pengajaran.",https://glints.com/id/opportunities/jobs/mandarin-tutor-pengajar-bahasa-mandarin-jakut-part-time/bd1e31df-90a2-4db5-b422-8087e397a268?utm_referrer=explore,https://images.glints.com/unsafe/glints-dashboard.s3.amazonaws.com/company-logo/37b0b94f925f35859e0ba04035443619.jpg;
gl629,Mandarin Tutor / Pengajar Bahasa Mandarin - Jaksel,CV. Kukche Mitra Sukses,Mandarin,"Kebayoran Lama, Jakarta Selatan, DKI Jakarta, Indonesia",Paruh Waktu,Tidak ditampilkan,Tidak ditampilkan,1 – 3 tahun,Tidak ditampilkan,Diploma (D1 - D4),,https://glints.com/id/opportunities/jobs/mandarin-tutor-pengajar-bahasa-mandarin-jaksel/3e9763ab-818e-4b9d-843b-8d18e7c29177?utm_referrer=explore,https://images.glints.com/unsafe/glints-dashboard.s3.amazonaws.com/company-logo/37b0b94f925f35859e0ba04035443619.jpg;
gl630,Mandarin Tutor / Pengajar Bahasa Mandarin - Jakut (Full Time),CV. Kukche Mitra Sukses,Fluent In Mandarin,"Kelapa Gading, Jakarta Utara, DKI Jakarta, Indonesia",Penuh Waktu,Tidak ditampilkan,"Rp3,5jt-Rp4,5jt",1 – 3 tahun,Tidak ditampilkan,Sarjana (S1),"Mempunyai kemampuan komunikasi yang baik., Berkomitmen dan mempunyai dedikasi tinggi dalam mengajar., Dapat bekerja sama dengan manajemen dalam pengarahan kurikulum dan teknis mengajar., Bersedia membuat konten untuk kebutuhan pembelajaran., Kreatif dalam metode mengajarkan materi pengajaran.",https://glints.com/id/opportunities/jobs/mandarin-tutor-pengajar-bahasa-mandarin-jakut-full-time/12bd8cae-d93a-40f6-8cf5-2926f6546997?utm_referrer=explore,https://images.glints.com/unsafe/glints-dashboard.s3.amazonaws.com/company-logo/37b0b94f925f35859e0ba04035443619.jpg;
gl631,Business Development,Looyal Indonesia,Business Negotiation,"Kelapa Dua, Tangerang, Banten, Indonesia",Penuh Waktu,Tidak ditampilkan,Rp3jt-Rp5jt,1 – 3 tahun,"Komunikasi Pemasaran, Pengembangan Bisnis, Penjualan B2B, Negosiasi Bisnis",Sarjana (S1),"At least 1 year of experience (fresh graduates are welcome), Experience in selling IT products is a plus, Excellent written and verbal communication skills, Able to work under pressure with target",https://glints.com/id/opportunities/jobs/business-development/901c5189-e876-4cdf-ad12-b93ae6eb907a?utm_referrer=explore,https://images.glints.com/unsafe/glints-dashboard.s3.amazonaws.com/company-logo/c51f4381619b6ed4799c5d382e809738.png;
gl632,Sales Admin (Lapangan),CV BALI BISA MANDIRI,Microsoft Office,"Ubud, Gianyar, Bali, Indonesia",Penuh Waktu,Tidak ditampilkan,Tidak ditampilkan,1 – 3 tahun,"Analisis Penjualan, Kemampuan Komunikasi, Microsoft Office, Negosiasi Pembelian",SMA/SMK,,https://glints.com/id/opportunities/jobs/sales-admin-lapangan/c0bb22ad-90e2-4782-b357-48c1b10b673a?utm_referrer=explore,https://images.glints.com/unsafe/glints-dashboard.s3.amazonaws.com/company-logo/142b77a54711f6a00943ceb93c9c4170.png;
gl633,Engineer CCTV IP Based,PT Mitra Kerja Utama,Networking,"Denpasar Barat, Denpasar, Bali, Indonesia",Penuh Waktu,Tidak ditampilkan,"Rp4,8jt-Rp5jt",1 – 3 tahun,"Jaringan IP, LAN, Jaringan",Diploma (D1 - D4),,https://glints.com/id/opportunities/jobs/engineer-cctv-ip-based/573f8641-2c25-4810-b0dc-b8edeb2d6e6b?utm_referrer=explore,https://images.glints.com/unsafe/glints-dashboard.s3.amazonaws.com/company-logo/712e2c5210fa4189372dc2dde406e85e.jpg;
gl634,Business Development,Looyal Indonesia,Business Negotiation,"Suko Manunggal, Surabaya, Jawa Timur, Indonesia",Penuh Waktu,Tidak ditampilkan,Rp3jt-Rp7jt,1 – 3 tahun,"Komunikasi Pemasaran, Pengembangan Bisnis, Penjualan B2B, Negosiasi Bisnis",Sarjana (S1),"At least 1 year of experience (fresh graduates are welcome), Experience in selling IT products is a plus, Excellent written and verbal communication skills, Able to work under pressure with target",https://glints.com/id/opportunities/jobs/business-development/2e3a61a5-ca5c-4dd2-9e30-4b5118322a8f?utm_referrer=explore,https://images.glints.com/unsafe/glints-dashboard.s3.amazonaws.com/company-logo/c51f4381619b6ed4799c5d382e809738.png;
gl635,Sales Executive,Meditrust Indonesia,Working under pressure,"Pancoran, Jakarta Selatan, DKI Jakarta, Indonesia",Penuh Waktu,Tidak ditampilkan,Tidak ditampilkan,Kurang dari setahun,"Bekerja di Bawah Tekanan, Penjualan dan Pemasaran, Kemampuan Komunikasi",SMA/SMK,"Pria dengan usia maks 35 tahun, Berpendidikan Minimal SMA dan seterusnya, Memiliki Kendaraan motor dan SIM C, Memiliki Pengalaman pekerjaan Marketing & Sales, Fresh Graduate Welcome, Bersedia ditempatkan di jakarta, Jujur, Berdedikasi dan berintergritas., Memiliki Jiwa Salesmanship yang kuat, Berpenampilan menarik dan komunikatif, Sanggup berkerja dengan pressure tinggi dalam mencapai target penjualan",https://glints.com/id/opportunities/jobs/sales-executive/12c59b53-863d-474a-90d1-053212a28405?utm_referrer=explore,https://images.glints.com/unsafe/glints-dashboard.s3.amazonaws.com/company-logo/e9b2c51c0a1fdac460ed049b4006304a.png;
gl636,Full Stack Engineer,Widya Analytic,TailwindCSS,"Kapanewon Depok, Sleman, DI Yogyakarta, Indonesia",Penuh Waktu,Tidak ditampilkan,"Rp3,5jt-Rp4jt",1 – 3 tahun,"Node.js, MySQL, Vue.js, Python, React.js, GIT, JSON, TailwindCSS, HTML5",Diploma (D1 - D4),"Melakukan pengembangan Front End dan Back End., Bertanggungjawab atas Application on Server Side and Application User Interface., Mengembangkan repositori kode yang dapat digunakan kembali., Memastikan keamanan terkait kerangka kerja, fungsi, dan pustaka untuk kerangka sisi server dan antarmuka pengguna., Memberikan saran dan masukan terkait pengembangan aplikasi dan teknologi.",https://glints.com/id/opportunities/jobs/full-stack-engineer/a48683bc-5650-4456-a636-e98642800d26?utm_referrer=explore,https://images.glints.com/unsafe/glints-dashboard.s3.amazonaws.com/company-logo/a2ebfb8120a9f7376b56e474d4c01562.jpeg;
gl637,Sales,Pt. Excellent Infotama Kreasindo,Sales Marketing,"Bekasi Timur, Bekasi, Jawa Barat, Indonesia",Penuh Waktu,Tidak ditampilkan,Tidak ditampilkan,1 – 3 tahun,Tidak ditampilkan,Diploma (D1 - D4),,https://glints.com/id/opportunities/jobs/sales/3b2da7d8-8fe6-4afa-82d6-f4d948116dab?utm_referrer=explore,https://images.glints.com/unsafe/glints-dashboard.s3.amazonaws.com/company-logo/d0daa175b6da8a042cf16e81f4d882d3.png;
gl638,Nurse,DVX Medical,Positive Attitude,"Gubeng, Surabaya, Jawa Timur, Indonesia",Penuh Waktu,Tidak ditampilkan,Tidak ditampilkan,1 – 3 tahun,"Kerja Tim, Kemampuan Komunikasi, Sikap Positif",Diploma (D1 - D4),"Perempuan usia <30 tahun, Minimal pendidikan D3 Perawat/Bidan, Teliti, rajin, jujur, bertanggung jawab dan mau belajar hal baru, Penempatan di Surabaya, STR perawat aktif, Memiliki kendaraan pribadi",https://glints.com/id/opportunities/jobs/nurse/b58aabb7-037f-40fb-947b-cd8f1e3b6cda?utm_referrer=explore,https://images.glints.com/unsafe/glints-dashboard.s3.amazonaws.com/company-logo/f50104f550cb9c097f48f5f7167389b3.jpg;
gl639,Content Writer (Unpaid Internship),PT Widya Adijaya Nusantara (Widya Security),Search Engine Optimization (SEO),"Kapanewon Depok, Sleman, DI Yogyakarta, Indonesia",Magang,Tidak ditampilkan,Tidak ditampilkan,Kurang dari setahun,"Search Engine Optimization (SEO), CMS, Penulisan Konten, Penulisan Iklan",Diploma (D1 - D4),"Have an interest in marketing, Min. semester 3 or fresh graduates in marketing, communication, management or related field, Responsible for end to end process of content writing, Familiar with Content Management Systems Proofread, Familiar with SEO guidelines, Verbal and written communication skills, Hybrid working, Unpaid Internship",https://glints.com/id/opportunities/jobs/content-writer-unpaid-internship/e1519bc3-4ef9-4525-81dc-577ef3e9eb4f?utm_referrer=explore,https://images.glints.com/unsafe/glints-dashboard.s3.amazonaws.com/company-logo/857358a9b3828962710e79f9d8b9064e.jpg;
gl640,Sales Executive,PT Dharma Khasanti Agung,Sales and Marketing,"Serpong, Tangerang Selatan, Banten, Indonesia",Penuh Waktu,Tidak ditampilkan,Tidak ditampilkan,1 – 3 tahun,"Penjualan dan Pemasaran, Penjualan B2C, Manajemen Ritel",SMA/SMK,"Menemukan dan menjalin networking dengan Customer baru, Menghimpun database calon-calon Distributor/ Retail potensial, Menganalisa kelayakan calon Distributor, Menjadi representasi Perusahaan dalam menjelaskan product knowledge dan paket kedistributoran/ Retail, Melakukan kunjungan berkala ke customer dalam dan luar kota, Mengakomodir administrasi Perusahaan kepada distributor/ Retail, Mengakomodir keluhan customer kepada Perusahaan, Mengelola data dan sales report di system ODOO",https://glints.com/id/opportunities/jobs/sales-executive/33c67036-d7aa-4abb-9848-127ffe29e6ef?utm_referrer=explore,https://images.glints.com/unsafe/glints-dashboard.s3.amazonaws.com/company-logo/e7c7132051ba4bde8df6cad470c1e8a5.jpeg;
gl641,Finance Account Receivable,PT Intimas Chemindo,Leadership Development,"Tangerang, Tangerang, Banten, Indonesia",Penuh Waktu,Tidak ditampilkan,Tidak ditampilkan,3 – 5 tahun,"Perangkat Lunak ERP, Pengembangan Kepemimpinan, Microsoft Office",Sarjana (S1),"Memastikan penagihan dan piutang diproses dengan benar dan tepat waktu., Mengatasi dan mengoreksi segala perbedaan dalam akun atau penagihan., Membuat jadwal penagihan kepada Kolektor setiap hari dengan benar, Berfungsi sebagai penghubung antara klien dan divisi terkait untuk menegosiasikan rencana pembayaran yang dapat diterima., Menarik dan menganalisa data sales dari sistem POS/ordering secara berkala, Menganalisa umur piuting yang merujuk akun yang sudah lewat jatuh tempo ke penagihan, Menyediakan atau memfasilitasi laporan dan analisis yang akurat terhadap data dan metrik penagihan untuk disajikan kepada BOD., Evaluasi dan inovasi tata cara kerja tim., Memastikan invoicing, collecting, reconciliation mutasi bank, dan receive payment tepat dan efektif waktu., Melaksanakan tugas lain yang ditugaskan.",https://glints.com/id/opportunities/jobs/finance-account-receivable/ad2ad945-c520-4846-934c-4af71d8220f5?utm_referrer=explore,https://images.glints.com/unsafe/glints-dashboard.s3.amazonaws.com/company-logo/c0a2a58cb893cdfdabbbbb05a98b6536.jpeg;
gl642,Asisten Apoteker,The Skinbars,Microsoft Office,"Banjarsari, Surakarta, Jawa Tengah, Indonesia",Penuh Waktu,Tidak ditampilkan,Tidak ditampilkan,1 – 3 tahun,"Kerja Tim, Microsoft Office, Administrasi",Diploma (D1 - D4),"Bertanggungjawab pada ketersediaan produk treatement dan homecare, Mempersiapkan produk treatement dan homecare, Membuat laporan harian, mingguan dan bulanan ketersediaan produk, Melaporkan produk yang hampir expired, Melakukan stock opname, Memiliki ketertarilkan pada bidang kecantikan dan perawatan diri",https://glints.com/id/opportunities/jobs/asisten-apoteker/e88d56e0-fc8f-4352-8570-33efef558b15?utm_referrer=explore,https://images.glints.com/unsafe/glints-dashboard.s3.amazonaws.com/company-logo/aabbc9c19d4ba88b7f7f4e33dc9e703d.png;
gl643,Social Media Specialist,CV BALI BISA MANDIRI,Social Media Marketing & Management,"Denpasar Barat, Denpasar, Bali, Indonesia",Penuh Waktu,Tidak ditampilkan,"Rp3jt-Rp3,5jt",1 – 3 tahun,"Perhatian terhadap Detail, Pengeditan Foto, Pemasaran & Manajemen Media Sosial, Pengeditan Video, Keterampilan Komunikasi",Diploma (D1 - D4),,https://glints.com/id/opportunities/jobs/social-media-specialist/5227e540-0356-4c9c-89f7-3f7f08ae13ee?utm_referrer=explore,https://images.glints.com/unsafe/glints-dashboard.s3.amazonaws.com/company-logo/142b77a54711f6a00943ceb93c9c4170.png;
gl644,Digital Advertiser Specialist,Dafi Pesantren Al-Quran Science Sidoarjo,Mathematical Modeling,"Sukodono, Sidoarjo, Jawa Timur, Indonesia",Penuh Waktu,Tidak ditampilkan,Tidak ditampilkan,Kurang dari setahun,"Mengajar Taman Kanak-kanak, Modeling Matematis, Mengajar Sekolah Dasar",Diploma (D1 - D4),,https://glints.com/id/opportunities/jobs/digital-advertiser-specialist/9253a45e-1fa3-4b4b-a85a-eb01049d275d?utm_referrer=explore,https://images.glints.com/unsafe/glints-dashboard.s3.amazonaws.com/company-logo/png;
gl645,Leader Marketing,PT. TAP KAPITAL INDONESIA,Sales and Marketing,"Tanah Abang, Jakarta Pusat, DKI Jakarta, Indonesia",Kontrak,Tidak ditampilkan,Tidak ditampilkan,5 – 10 tahun,"Komunikasi Pemasaran, Digital Marketing, Penjualan dan Pemasaran",Sarjana (S1),"Mengembangkan rencana merek dan strategi pemasaran yang efektif dan inovatif untuk membangun merek yang kuat, Menciptakan pesan merek yang akan meningkatkan penjualan, Mengembangkan strategi merek untuk meningkatkan citra merek, Mengelola agensi dan klien eksternal untuk meningkatkan penjualan pasar, Bekerja sama erat dengan tim berbeda di perusahaan untuk memastikan konsistensi merek",https://glints.com/id/opportunities/jobs/leader-marketing/bbe341eb-e22f-40c1-a987-6a60d447a0ca?utm_referrer=explore,https://images.glints.com/unsafe/glints-dashboard.s3.amazonaws.com/company-logo/39773321f223e43e41cf1b2761a71294.jpeg;
gl646,Brand Specialist,Clout Indonesia Group,Leadership,"Kelapa Dua, Tangerang, Banten, Indonesia",Penuh Waktu,Tidak ditampilkan,Tidak ditampilkan,1 – 3 tahun,"Komunikasi Pemasaran, Digital Marketing, Manajemen Proyek, Pengembangan Merek, Strategi Pemasaran, E-commerce",Sarjana (S1),"Develop and execute strategic plans to enhance brand visibility, engagement, and sales within E-Commerce., Lead and mentor teams for effective execution of marketing, sales, and promotional initiatives., Collaborate across teams to achieve business objectives., Utilize your extensive E-Commerce and marketing communication experience to identify market trends., Build strong relationships with stakeholders, partners, and vendors., Analyze and manage budgets, timelines, and resources.",https://glints.com/id/opportunities/jobs/brand-specialist/905ce7b7-6a7f-4f53-a636-39bdb58cc494?utm_referrer=explore,https://images.glints.com/unsafe/glints-dashboard.s3.amazonaws.com/company-logo/18f35fb7af02e4768db1d7bedfc2fbd1.png;
gl647,QA QC SUPERVISOR,PT. Indosari Mandiri (Isami Foods),Leadership Development,"Neglasari, Tangerang, Banten, Indonesia",Penuh Waktu,Tidak ditampilkan,Tidak ditampilkan,3 – 5 tahun,"Pengembangan Kepemimpinan, Penjaminan Kualitas, Quality Control, Administrasi",Sarjana (S1),,https://glints.com/id/opportunities/jobs/qa-qc-supervisor/61e4b5c7-4079-44e8-aa55-e56ed9a5dab6?utm_referrer=explore,https://images.glints.com/unsafe/glints-dashboard.s3.amazonaws.com/company-logo/469fefec28ffb38e5d8e28f12026dfec.png;
gl648,Accounting,PT LENTERA PERMAI OETAMA,Tax Brevet A&b,"Cengkareng, Jakarta Barat, DKI Jakarta, Indonesia",Penuh Waktu,Tidak ditampilkan,Tidak ditampilkan,3 – 5 tahun,"Akuntansi, Microsoft Office, Account Management",Sarjana (S1),,https://glints.com/id/opportunities/jobs/accounting/4a084362-1234-49e5-a193-87912b6a4af1?utm_referrer=explore,https://images.glints.com/unsafe/glints-dashboard.s3.amazonaws.com/company-logo/323076a99b7fe537af4fd82476dcf0bf.jpg;
gl649,Kasir,SYDNEY & FRIENDS BAKERY,Sales Operations,"Prajurit Kulon, Mojokerto, Jawa Timur, Indonesia",Penuh Waktu,Tidak ditampilkan,Tidak ditampilkan,1 – 3 tahun,"Cash Management, Penjualan B2C, Operasi Penjualan",SMA/SMK,"Menerima pembayaran dari pelanggan dengan akurat dan efisien., Menghitung kembali uang tunai untuk memastikan kesesuaiannya dengan total transaksi., Menyediakan informasi produk, harga, dan promosi kepada pelanggan., Menangani pertanyaan dan keluhan pelanggan dengan sopan dan profesional., Mengelola transaksi non-tunai seperti pembayaran dengan kartu kredit atau sistem pembayaran elektronik., Menghasilkan laporan keuangan harian dan melakukan rekonsiliasi kas",https://glints.com/id/opportunities/jobs/kasir/14b699ef-e505-470d-b595-b025d4b89757?utm_referrer=explore,https://images.glints.com/unsafe/glints-dashboard.s3.amazonaws.com/company-logo/070d8ae5e1d9eb185161c8e732e6d1eb.png;
gl650,Koordinator dan Anggota Konsultan,PT KOKEK,Leadership Development,"Tenggilis Mejoyo, Surabaya, Jawa Timur, Indonesia",Kontrak,Tidak ditampilkan,Tidak ditampilkan,3 – 5 tahun,"Pengembangan Kepemimpinan, Kerja Tim, Manajemen Proyek, Microsoft Office, Keterampilan Komunikasi",Sarjana (S1),,https://glints.com/id/opportunities/jobs/koordinator-dan-anggota-konsultan/a7f7f4ab-70e0-4957-8d2d-0049a0cdc681?utm_referrer=explore,https://images.glints.com/unsafe/glints-dashboard.s3.amazonaws.com/company-logo/c39e036bcebefac0f06830cc69a0374f.png;
gl651,Staff,G-PARK,Positive Attitude,"Kebomas, Gresik, Jawa Timur, Indonesia",Penuh Waktu,Tidak ditampilkan,Tidak ditampilkan,1 – 3 tahun,"Kerja Tim, Kemampuan Komunikasi, Sikap Positif",SMA/SMK,,https://glints.com/id/opportunities/jobs/staff/7a8f0d55-8785-498d-97ee-89690c5fe161?utm_referrer=explore,https://images.glints.com/unsafe/glints-dashboard.s3.amazonaws.com/company-logo/6b9aae465e9a22728f88c05d977c5e98.jpg;
gl652,Cashier,G-PARK,Positive Attitude,"Kebomas, Gresik, Jawa Timur, Indonesia",Penuh Waktu,Tidak ditampilkan,Tidak ditampilkan,1 – 3 tahun,"Kerja Tim, Kemampuan Komunikasi, Sikap Positif",SMA/SMK,,https://glints.com/id/opportunities/jobs/cashier/02d7e1e9-ce63-4b17-a8b6-e43735a30c1c?utm_referrer=explore,https://images.glints.com/unsafe/glints-dashboard.s3.amazonaws.com/company-logo/6b9aae465e9a22728f88c05d977c5e98.jpg;
