id,Job_title,Company,Category,Location,Work_type,Working_type,Salary,Experience,Skills,Study_requirement,Desc,Link
gl0,Brain Development Teacher for kids,PT. Genius Kidz Indonesia,Basic Mathematics,"Kelapa Gading, Jakarta Utara, DKI Jakarta, Indonesia",Penuh Waktu,Tidak ditampilkan,Rp4jt-Rp5jt,1 – 3 tahun,Tidak ditampilkan,Sarjana (S1),,https://glints.com/id/opportunities/jobs/brain-development-teacher-for-kids/511092c0-3606-4a64-8847-fb528a1bf763?utm_referrer=explore
gl1,VUE JS DEVELOPER,Pt Bionic Teknologi Indonesia,Springboot,"Tebet, Jakarta Selatan, DKI Jakarta, Indonesia",Penuh Waktu,Tidak ditampilkan,Tidak ditampilkan,1 – 3 tahun,"JavaScript, Vue Js (nuxt Js), Vue Js, Bootstrap, Springboot, Java Programming",SMA/SMK,,https://glints.com/id/opportunities/jobs/vue-js-developer/8a327e33-ac67-4a7d-9eb8-ef80993551d2?utm_referrer=explore
gl2,Video DIRECTOR,Media Fakta Global,Project Management,"Pancoran, Jakarta Selatan, DKI Jakarta, Indonesia",Penuh Waktu,Tidak ditampilkan,Tidak ditampilkan,Lebih dari 10 tahun,"Manajemen Waktu, Creative Thinking, Project Management, Video Editor, Multimedia",Sarjana (S1),,https://glints.com/id/opportunities/jobs/video-director/b1a10118-3551-451c-ab0c-de42e7f2222b?utm_referrer=explore
gl3,Video Editor dan Motion Grafic,Media Fakta Global,Kreatif Dan Inovatif,"Pancoran, Jakarta Selatan, DKI Jakarta, Indonesia",Penuh Waktu,Tidak ditampilkan,Tidak ditampilkan,5 – 10 tahun,Tidak ditampilkan,Sarjana (S1),,https://glints.com/id/opportunities/jobs/video-editor-dan-motion-grafic/484343b8-8ca6-433a-92d5-151201c2bced?utm_referrer=explore
gl4,Art Director,Media Fakta Global,"Komunikatif, Kreatif, Inovatif","Pancoran, Jakarta Selatan, DKI Jakarta, Indonesia",Penuh Waktu,Tidak ditampilkan,"Rp6,9jt-Rp8,9jt",5 – 10 tahun,Tidak ditampilkan,Sarjana (S1),,https://glints.com/id/opportunities/jobs/art-director/5e78afdd-ef6b-4ac1-8476-6339821da45f?utm_referrer=explore
gl5,Animator,Media Fakta Global,3ds Max,"Pancoran, Jakarta Selatan, DKI Jakarta, Indonesia",Penuh Waktu,Tidak ditampilkan,Tidak ditampilkan,1 – 3 tahun,Tidak ditampilkan,Sarjana (S1),"Minimal S1 di bidang Animasi, Seni Rupa atau bidang terkait, Pengalaman 1-3 tahun di media kreatif, Pengalaman yang terbukti dengan portofolio mendukung (Animasi), Kemampuan dalam menggunakan Adobe illustrator, Adobe After Effect, Autodesk Maya, Rotoscope Animation dan lain sebagainya., Pengetahuan tentang rigging 3D, Mampu membuat Storyline dan Storyboard, Paham alur kerja media., Kemampuan bekerja secara tim maupun individu., Mampu memahami kebutuhan industri., Pengalaman organisasi/komunitas menjadi nilai tambah, Pengalaman kerja di media massa menjadi nilai tambah, Menguasai bahasa Inggris menjadi nilai tambah, Bersedia bekerja dibawah tekanan, Berpikir kreatif dan strategis, Memiliki keterampilan interpersonal dan komunikasi yang bagus",https://glints.com/id/opportunities/jobs/animator/e4542a20-e282-4e13-a6c2-0d1c8919c9f0?utm_referrer=explore
gl6,3D artist,PT. Citra Mediatama Indonesia,3D MODELLING BLENDER,"Mampang Prapatan, Jakarta Selatan, DKI Jakarta, Indonesia",Penuh Waktu,Tidak ditampilkan,Tidak ditampilkan,1 – 3 tahun,Tidak ditampilkan,Sarjana (S1),"Candidates must hold S1 or D3 qualifications., Analyzing and discussing project briefs with the Corporate Director and Head of Creative Production is a key responsibility., The ability to produce 3D designs according to approved guidelines from the Corporate Director is essential., Proficiency in Blender 3D Animation+, Adobe Photoshop, and Adobe After Effects (VFX & Motion Graphics) is a requirement., Rendering 3D design drafts while ensuring adherence to quality standards is expected., Designing automotive 3D models is a mandatory skill., Quality control of 3D designs before reporting to the Corporate Director is part of the job., Candidates should be prepared to await feedback from the Corporate Director and Client on 3D designs., Ensuring the quality of final 3D designs and taking responsibility for revisions is obligatory., Collaborating with the Corporate Director on final Quality Control before client presentations is a crucial aspect of the role., The position requires on-site work at our office (WFO).",https://glints.com/id/opportunities/jobs/3d-artist/abf80a51-06b8-480f-99c5-c7fc5aa244a7?utm_referrer=explore
gl7,Penerjemah Bahasa Mandarin,PT Realway Media Indonesia,Chinese HSK 5,"Kelapa Gading, Jakarta Utara, DKI Jakarta, Indonesia",Kontrak,Tidak ditampilkan,Rp8jt-Rp15jt,1 – 3 tahun,"Chinese HSK 5, Memiliki Kemampuan Komunikasi Yang Baik, Fluent In Mandarin",SMA/SMK,,https://glints.com/id/opportunities/jobs/penerjemah-bahasa-mandarin/3351dd5c-20a4-43a8-8081-db048a09f01b?utm_referrer=explore
gl8,Dokter Umum/Aesthetic,PT. Guobin International Indonesia,Mampu berkomunikasi dengan bahasa Indonesia maupun dengan bahsa Inggris dengan baik,"Medan Timur, Medan, Sumatera Utara, Indonesia",Kontrak,Tidak ditampilkan,Tidak ditampilkan,1 – 3 tahun,Tidak ditampilkan,Sarjana (S1),,https://glints.com/id/opportunities/jobs/dokter-umum-aesthetic/091152c5-c913-4bba-aae2-a845a7d1e15b?utm_referrer=explore
gl9,IT Infrastructure,PT Lumos Inisiatif Indonesia,Azure,"Kebon Jeruk, Jakarta Barat, DKI Jakarta, Indonesia",Penuh Waktu,Tidak ditampilkan,Tidak ditampilkan,1 – 3 tahun,"Azure, Linux, Alicloud, Docker, Kubernetes, Windows, Amazon Web Services (AWS), Cloud Computing",Diploma (D1 - D4),,https://glints.com/id/opportunities/jobs/it-infrastructure/c98be130-fa5a-4d23-a87f-d9d1ce466ce2?utm_referrer=explore
gl10,Sales Executive,PT Istana Surya Perkasa,Sales and Marketing,"Sawahan, Surabaya, Jawa Timur, Indonesia",Penuh Waktu,Tidak ditampilkan,Tidak ditampilkan,1 – 3 tahun,"Sales and Marketing, B2b Sales, Retail Sales",SMA/SMK,"Laki- Laki, maksimal 38 tahun, Pendidikan minimal SMA/SMK/D1 (Teknik Mesin diutamakan), Pengalaman minimal 2 tahun di bidang yang sama, Kemampuan komunikasi dan negosiasi yang baik, Memahami penjualan mesin, sparepart dan dinami, Pengetahuan tentang administrasi sales  teknologi informasi diperlukan, Bersedia dinas luar kota dan pulau, Diutamakan menguasai wilayah Indonesia Barat ( JABAR, DKI, BANTEN, & SUMATERA), Penempatan Surabaya",https://glints.com/id/opportunities/jobs/sales-executive/f142a78e-98ce-4e61-b418-e00c746bd662?utm_referrer=explore
gl11,Digital Paid-Advertising Associates,Based By Basil,Google Ads,"Kalideres, Jakarta Barat, DKI Jakarta, Indonesia",Penuh Waktu,Tidak ditampilkan,"Rp4,5jt-Rp6jt",1 – 3 tahun,Tidak ditampilkan,Sarjana (S1),"Manage brand ad account on Ads Manager and monitor their progress throughout the day. (Mainly Facebook/Meta Ads), Provide daily ad reports detailing any changes in their performance as well as any changes you made to its activity., Monitor and maximize campaign budgets to meet their respective KPIs., Content planning and copywriting for clients., Write up monthly performance report.",https://glints.com/id/opportunities/jobs/digital-paid-advertising-associates/92198b26-5728-4eb4-a8be-31fd20fb7267?utm_referrer=explore
gl12,Senior Product Admin,PT Smoot Motor Indonesia,Standard Operating Procedure (SOP),"Cakung, Jakarta Timur, DKI Jakarta, Indonesia",Kontrak,Tidak ditampilkan,Tidak ditampilkan,3 – 5 tahun,"Standard Operating Procedure (SOP), Microsoft Office, Office Administration, Administration",Diploma (D1 - D4),"Laki-laki, Pendidikan Minimal D3/S1 Manajemen / Administrator, berpengalaman minimal 3 tahun di level staff), Berpengalaman membuat SOP / Instruksi Kerja / Proposal, Berpengalaman mengoperasikan dan mengolah data di Ms Office / Google Workspace, Memiliki kemampuan dalam mengalisa proses dan Problem Solving, Kemampuan komunikasi dan manajemen waktu yang baik",https://glints.com/id/opportunities/jobs/senior-product-admin/ccad0981-318c-416e-b3b2-bf73bce8b8dd?utm_referrer=explore
gl13,Marketing Property,MIRALAND,Disiplin Dan Jujur,"Kuta Selatan, Badung, Bali, Indonesia",Penuh Waktu,Tidak ditampilkan,Rp3jt-Rp5jt,Kurang dari setahun,"Disiplin Dan Jujur, Jujur, teliti, dan rajin, Memiliki Kemampuan Komunikasi Yang Baik",SMA/SMK,,https://glints.com/id/opportunities/jobs/marketing-property/7b437135-2756-46bf-9508-86e03472be51?utm_referrer=explore
gl14,Sales Supervisor area Semarang,PT. Ulam Tiba Halim (marifood),Strategi Penjualan,"Ngaliyan, Semarang, Jawa Tengah, Indonesia",Penuh Waktu,Tidak ditampilkan,"Rp3,5jt-Rp3,5jt",1 – 3 tahun,Tidak ditampilkan,Sarjana (S1),"Mengatur dan melakukan kunjungan penjualan, Menjaga hubungan dengan customer, Bekerja sama dengan tim yang ada dibawahnya untuk mencapai target penjualan, Menjalankan program marketing yang berjalan, Mengelola catatan aktivitas penjualan dan menyusun laporan penjualan",https://glints.com/id/opportunities/jobs/sales-supervisor-area-semarang/59c56c7f-1725-4e03-b0f0-da31e63775b9?utm_referrer=explore
gl15,Desain Grafis,PT Tripoint Centralindo,Desain Grafis,"Sidoarjo, Sidoarjo, Jawa Timur, Indonesia",Penuh Waktu,Tidak ditampilkan,Tidak ditampilkan,1 – 3 tahun,Tidak ditampilkan,SMA/SMK,"Membuat dan merancang materi branding atau iklan, Membuat materi iklan cetak dan digital, Mengembangkan Visual Utama dan Materi Pendukung untuk Kampanye Pemasaran, Membantu dalam pengelolaan situs web, buletin, dan lainny, Mendesain materi grafis, penjualan, dan pemasaran, misalnya EDM / Poster / Spanduk / Display Penjualan, Mengelola Desain dari Konsep hingga Produksi, Berinteraksi dengan percetakan eksternal atau kontraktor/pemasok untuk memastikan kualitas terbaik dan pemenuhan tenggat waktu, Mendokumentasikan dengan baik semua file desain",https://glints.com/id/opportunities/jobs/desain-grafis/3c11f1e5-41cb-4005-a019-e84ed6da1752?utm_referrer=explore
gl16,Staff Branding,CV. Vicci,Branding,"Babakan Ciparay, Bandung, Jawa Barat, Indonesia",Penuh Waktu,Tidak ditampilkan,Rp2jt-Rp4jt,1 – 3 tahun,Tidak ditampilkan,Diploma (D1 - D4),,https://glints.com/id/opportunities/jobs/staff-branding/ba415c14-304d-4a3b-9e24-a9f15cadb9e6?utm_referrer=explore
gl17,Video Editor,PT Ethos Kreatif Indonesia,Sosial Media Management,"Kemayoran, Jakarta Pusat, DKI Jakarta, Indonesia",Penuh Waktu,Tidak ditampilkan,Tidak ditampilkan,1 – 3 tahun,Tidak ditampilkan,SMA/SMK,"Pendidikan minimal SMA/SMK semua jurusan, Berpengalaman minimal 1 tahun di bidang yang sama menjadi nilai plus, Mahir dalam penggunaan Software Adobe Premiere Pro atau Davinci Ressolve Edit, Memiliki kepekaan yang kuat terhadap komposisi, pencahayaan, warna, serta keterampilan teknis yang kuat, Mampu untuk mempelajari perangkat lunak/teknik baru dengan cepat, Mengikuti tren social media, tren editing dan berpikir kreatif",https://glints.com/id/opportunities/jobs/video-editor/9d3c422a-0415-47d1-9508-e9f29d5330ce?utm_referrer=explore
gl18,HR Senior Staff,Mutiara Harapan Islamic School,HR Generalist,"Pondok Aren, Tangerang Selatan, Banten, Indonesia",Penuh Waktu,Tidak ditampilkan,Tidak ditampilkan,3 – 5 tahun,"HR & Payroll, HR Generalist, End To End Recruitment, Personnel Management, Legal Drafting",Sarjana (S1),"Manage the complete recruitment life cycle, including sourcing, screening, interviewing, and onboarding candidates., Ensure strict compliance with employment regulations, teacher and lecturer regulations, and other pertinent laws within an educational setting., Exhibit strong administrative skills to efficiently manage HR-related tasks and streamline processes., Develop and implement HR policies and procedures that align with the school's values and objectives., Collaborate closely with various departments to address HR-related challenges and provide guidance.",https://glints.com/id/opportunities/jobs/hr-senior-staff/e02252ae-6cbc-4bbf-a689-0ce297cb816f?utm_referrer=explore
gl19,Business Development Manager,PT Beautinesia Media Nusantara,Sales Marketing,"Setiabudi, Jakarta Selatan, DKI Jakarta, Indonesia",Penuh Waktu,Tidak ditampilkan,Tidak ditampilkan,3 – 5 tahun,"Advertising Agency, B2b Sales, Good Communication Skills, dealing with client, Sales Marketing",Sarjana (S1),"Building, developing, and sustaining solid relationships with company stakeholders and customers., Identifying new business opportunities and the most effective approach to pursue them., Building and managing client pipelines, and closing deals., Achieving business development targets., Working closely and coordinating with the operational team and business team in Beautynesia., Analyzing customer feedback data to improve and expand our offerings and deepen our relationships.",https://glints.com/id/opportunities/jobs/business-development-manager/69dbe46b-f2e8-43af-9867-996c4b54b625?utm_referrer=explore
gl20,Supply Chain Management Staff,PT Ethos Kreatif Indonesia,Data Analyst,"Cilacap Tengah, Cilacap, Jawa Tengah, Indonesia",Penuh Waktu,Tidak ditampilkan,Tidak ditampilkan,1 – 3 tahun,Tidak ditampilkan,Diploma (D1 - D4),"Mengelola proses perencanaan inventaris untuk memastikan tingkat stok yang optimal, Menganalisis data penjualan dan meninjau forecast accuracy, Menjaga realisasi perencanaan inbound dan outbound untuk memastikan seluruh transaksi tercatat berdasarkan permintaan, Berhubungan dengan Sales, Principal dan bagian lain untuk mengatasi masalah yang terkait dengan proses demand supply",https://glints.com/id/opportunities/jobs/supply-chain-management-staff/5eb6b21d-2ec0-4711-be87-0d2560bb3f6d?utm_referrer=explore
gl21,Marketing Staff,Wenfeng International Group,Fragrance,"Penjaringan, Jakarta Utara, DKI Jakarta, Indonesia",Penuh Waktu,Tidak ditampilkan,Tidak ditampilkan,1 – 3 tahun,Tidak ditampilkan,Diploma (D1 - D4),"Create detailed business plans to facilitate the attainment of goals and quotas, Manage the entire sales cycle from finding a client to securing a deal, Unearth new sales opportunities through networking and turn them into long term partnerships, Present Our Company Products to prospective clients, Provide professional after-sales support to enhance the customers’ dedication, Remain in frequent contact with the clients in your responsibility to understand their needs, Respond to complaints and resolve issues aiming to customer contentment and the preservation of the company’s reputation, Negotiate agreements and keep records of sales and data",https://glints.com/id/opportunities/jobs/marketing-staff/9e7cc990-2653-452e-b9bf-66d9585079ac?utm_referrer=explore
gl22,Software Engineer,Fajar Korpora Indonesia,Software Engineering,"Serang, Serang, Banten, Indonesia",Penuh Waktu,Tidak ditampilkan,Tidak ditampilkan,1 – 3 tahun,Tidak ditampilkan,SMA/SMK,"Pria Maksinal Usia 30 tahun, Penidikan Min SMK/STM, jurusan Elektronika, TKJ, Informatika, Pengalaman Min 1 ahun dibidang ISP, ICT, Karakteristik, bersedia belajar, bisa bekerjasma dengan team, mengutamakan pelayanan kepada pelanggan",https://glints.com/id/opportunities/jobs/software-engineer/338998a2-4039-4a3d-9238-7633f2b8f6fb?utm_referrer=explore
gl23,Master Teacher Computer Science Kurikulum Internasional,Edumatrix Indonesia,Kreatif Dan Inovatif,"Kapanewon Mlati, Sleman, DI Yogyakarta, Indonesia",Paruh Waktu,Tidak ditampilkan,Tidak ditampilkan,1 – 3 tahun,Tidak ditampilkan,Sarjana (S1),,https://glints.com/id/opportunities/jobs/master-teacher-computer-science-kurikulum-internasional/e436d327-f08d-49bb-830e-efd09fbb3590?utm_referrer=explore
gl24,Marcomm & Social Media Specialist Staff,PT. Mido Indonesia,Adobe Illustrator,"Sawangan, Depok, Jawa Barat, Indonesia",Kontrak,Tidak ditampilkan,Tidak ditampilkan,1 – 3 tahun,"Adobe Illustrator, Canva Design, Adobe Photoshop",Sarjana (S1),"Mengelola aktivitas website dan content social media (Instagram, Tiktok, Facebook, Twitter, Linkedin, dll)., Meningkatkan brand awareness untuk mendukung penjualan secara online dan offline., Membangun relationship dengan pihak vendor/ mall/ dept.store, maunpun customer., Mengorganisir pameran/ event marketing., Membuat banner design untuk kegiatan promosi.",https://glints.com/id/opportunities/jobs/marcomm-and-social-media-specialist-staff/41abd39a-d62c-4150-894c-b5c4e53d8976?utm_referrer=explore
gl25,Secretary - Site Project,PT Woh Hup Indonesia,Ms Office,"Cikarang Pusat, Bekasi, Jawa Barat, Indonesia",Penuh Waktu,Tidak ditampilkan,Tidak ditampilkan,1 – 3 tahun,Tidak ditampilkan,Diploma (D1 - D4),"Menyiapkan segala keperluan meeting yang dihadiri direktur dan membuat notulen, Menyusun dan membuat jadwal kegiatan direktur, Melaksanakan administratif, surat meyurat, dan pengarsipan, Melaksanakan perisapan bahan kerja, Melakukan notulensi dalam kegiatan meeting atau rapat berkala pimpinan, Melaksanakan tugas langsung di intruksikan oleh pimpinan, Menjadi konektor antara direksi dengan staff dan manager, Mencatat dan memfollow up hasil meeting ke PIC terkait baik internal maupun eksternal",https://glints.com/id/opportunities/jobs/secretary-site-project/8b425ff9-081e-4a17-af7a-f98aba6819fe?utm_referrer=explore
gl26,KORWIL SECURITY,PT Delta Tekno Perkasa,Able To Create Good Relationship With Peoples,"Kebon Jeruk, Jakarta Barat, DKI Jakarta, Indonesia",Kontrak,Tidak ditampilkan,Rp4jt-Rp5jt,3 – 5 tahun,"Strong Leadership Skills, Able To Create Good Relationship With Peoples, Teamwork And Interpersonal Skills",SMA/SMK,"Memahami dan mengerti tugas dan tanggung jawab seorang kordinator security, Membuat perencanaan system keamanan dan kegiatan operasional kerja, Membuat perencanaan kerja mingguan, bulanan dan tahunan, Menerapkan prosedur tetap atau pun sistem prosedur dengan baik dan efektif, Melakukan koordinasi bersama aparat setempat seperti tokoh masyarakat, Pemda dan Polri, Mengkomunikasikan kebijakan yang telah ditetapkan oleh bagian managemen ke bagian internal di perusahaan, Melakukan pembinaan terhadap semua bawahan, Menegakkan kedisiplinan kepada bawahannya dan berikan instruksi kerja secara jelas",https://glints.com/id/opportunities/jobs/korwil-security/3169d644-4221-4dec-890c-42971caf450c?utm_referrer=explore
gl27,Bridal Couture Boutiqe - Sanur,Phangsanny,Fluent In English Both Oral And Written,"Denpasar Timur, Denpasar, Bali, Indonesia",Penuh Waktu,Tidak ditampilkan,Rp3jt-Rp5jt,1 – 3 tahun,"Customer Service, Fashion Store Display, Fluent In English Both Oral And Written",SMA/SMK,"Female (21 - 30 y.o), Fluent in English, Sallary : 3 mio - 5 mio per month, Commissions, Education: High school diploma or equivalent.",https://glints.com/id/opportunities/jobs/bridal-couture-boutiqe-sanur/d317073d-a459-4368-bab8-a7c903b5d165?utm_referrer=explore
gl28,PPJK (Export-Import),PT. Andalan Niaga Expressindo,Ms Office,"Pancoran, Jakarta Selatan, DKI Jakarta, Indonesia",Penuh Waktu,Tidak ditampilkan,Tidak ditampilkan,1 – 3 tahun,Tidak ditampilkan,Sarjana (S1),"Min D3, 2-3 years of experience in the export-import business, Certified Kepabeanan is required, Good knowledge about export-import by sea & air, Good in written and spoken english, Good knowledge MS Office",https://glints.com/id/opportunities/jobs/ppjk-export-import/44170401-7421-40dd-a9e9-a25a33d8e59e?utm_referrer=explore
gl29,Front Office - Jakarta Utara,CV. Kukche Mitra Sukses,Microsoft Office,"Kelapa Gading, Jakarta Utara, DKI Jakarta, Indonesia",Penuh Waktu,Tidak ditampilkan,"Rp2,5jt-Rp3jt",1 – 3 tahun,Tidak ditampilkan,SMA/SMK,,https://glints.com/id/opportunities/jobs/front-office-jakarta-utara/8a3955e5-cf22-49d4-a32c-9bdb51fc8bc7?utm_referrer=explore
gl30,Front Office - Jakarta Utara,CV. Kukche Mitra Sukses,Microsoft Office,"Kelapa Gading, Jakarta Utara, DKI Jakarta, Indonesia",Penuh Waktu,Tidak ditampilkan,"Rp2,5jt-Rp3jt",1 – 3 tahun,Tidak ditampilkan,SMA/SMK,,https://glints.com/id/opportunities/jobs/front-office-jakarta-utara/8a3955e5-cf22-49d4-a32c-9bdb51fc8bc7?utm_referrer=explore
gl31,Dokter Umum,PT Medisata Global Solusi,Emphatic Skills,"Kebon Jeruk, Jakarta Barat, DKI Jakarta, Indonesia",Penuh Waktu,Tidak ditampilkan,Tidak ditampilkan,1 – 3 tahun,Tidak ditampilkan,Sarjana (S1),"Minimal S1 Kedokteran, Mampu melakukan diagnosa, Memiliki STR yang aktif, Bersedia kerja full time, Jujur, bekerja keras, dan disiplin, Penempatan di Kedoya, Jakarta Barat",https://glints.com/id/opportunities/jobs/dokter-umum/c62b4278-df00-48df-9d7e-8ea045df3f58?utm_referrer=explore
gl32,Telemarketing Officer for Skincare Products,PT New Sea Indonesia,Mampu berkomunikasi dengan bahasa Indonesia maupun dengan bahsa Inggris dengan baik,"Cempaka Putih, Jakarta Pusat, DKI Jakarta, Indonesia",Penuh Waktu,Tidak ditampilkan,Tidak ditampilkan,1 – 3 tahun,"Persuasive Selling, Telemarketing skill, Mampu berkomunikasi dengan bahasa Indonesia maupun dengan bahsa Inggris dengan baik, Berkomunikasi Dengan Baik",SMA/SMK,,https://glints.com/id/opportunities/jobs/telemarketing-officer-for-skincare-products/459f2cf3-869a-4cb7-83fc-928911d2a3b1?utm_referrer=explore
gl33,IT Development (Full-Stack),JIC Digital Media,Fullstack Developer,"Cipondoh, Tangerang, Banten, Indonesia",Penuh Waktu,Tidak ditampilkan,Rp8jt-Rp15jt,3 – 5 tahun,"Network Security, Docker, Fullstack Developer, Agile Project Management",Sarjana (S1),"Write well-designed, testable, and efficient codes, Building features and applications with a responsive design, Gather and evaluating user feedback, Troubleshoot, debug, and upgrade software, Develop and manage software related aspects of product development including app, webpage design & maintenance, and program codes upgrading, Stay up-to-date with the latest web development technologies",https://glints.com/id/opportunities/jobs/it-development-full-stack/05160f87-68d3-44f7-a407-8e1bdc24b6d2?utm_referrer=explore
gl34,Resepsionis F&B,PT. Ogurindo Sejahtera Selalu (Oguri Cafe),Fluent In Mandarin,"Penjaringan, Jakarta Utara, DKI Jakarta, Indonesia",Penuh Waktu,Tidak ditampilkan,"Rp4,2jt",1 – 3 tahun,"Marketing Communications, Digital Marketing, Fluent In Mandarin, Content Creator, Database Administration, Receptionist Duties",SMA/SMK,,https://glints.com/id/opportunities/jobs/resepsionis-f-and-b/e93b539c-fdef-4ed2-b591-fac679e9fa62?utm_referrer=explore
gl35,Ecommerce Specialist / Marketplace Specialist,PT Distributor Gadget Indonesia,Shopee Ads,"Gambir, Jakarta Pusat, DKI Jakarta, Indonesia",Penuh Waktu,Tidak ditampilkan,Tidak ditampilkan,1 – 3 tahun,Tidak ditampilkan,SMA/SMK,"Mengelola Marketplace (Upload produk, Update Stock & Harga, dll), Membuat strategi agar toko di marketplace / E-Commerce (tokopedia, bukalapak, shopee, dsb) bisa mencapai target penjualan, Mengoptimalisasi iklan berbayar di e-commerce, Menjalankan jobdesc lain sesuai dengan ruang lingkup posisi",https://glints.com/id/opportunities/jobs/ecommerce-specialist-marketplace-specialist/9a8d961e-a385-4e2a-898d-970bc40b06a1?utm_referrer=explore
gl36,Fashion Designer,PT. DWIE MUSLIMAH JAYA,Digital Illustration,"Cengkareng, Jakarta Barat, DKI Jakarta, Indonesia",Penuh Waktu,Tidak ditampilkan,"Rp5jt-Rp6,5jt",1 – 3 tahun,Tidak ditampilkan,Diploma (D1 - D4),"Membuat desain busana (fashion modest) khususnya syar'i dan memvisualisasikan desainnya kepada Brand Owner., Aktif dan produktif mencari tahu tentang tren busana (fashion modest) terkini., Mengolah desain dan menyesuaikan serta menerapkan ke bahan yang sesuai hingga menjadi baju sampel., Berkoordinasi dengan tim internal terkait pada proses pembuatan sampel hingga tahap produksi busana yang di desain., Melakukan review analisa desain untuk setiap koleksi baju yang sudah diproduksi dan dijual ke market.",https://glints.com/id/opportunities/jobs/fashion-designer/b3f083f9-0699-425d-b201-3d267c4d2804?utm_referrer=explore
gl37,Implementator B2B Market,Djoin,B2b Selling Experience,"Denpasar Utara, Denpasar, Bali, Indonesia",Penuh Waktu,Tidak ditampilkan,Tidak ditampilkan,1 – 3 tahun,Tidak ditampilkan,Sarjana (S1),,https://glints.com/id/opportunities/jobs/implementator-b2b-market/78f09000-58cf-464e-8364-12b652aa8939?utm_referrer=explore
gl38,Sales Store Makassar,PT. KODE NIAGA TAMA,Sales Marketing,"Mamajang, Makassar, Sulawesi Selatan, Indonesia",Penuh Waktu,Tidak ditampilkan,"Rp3jt-Rp4,5jt",1 – 3 tahun,"Berorientasi Pada Target, Penjualan Dan Pemasaran, Sales and Marketing, Penjualan, Berkomunikasi Dengan Baik, Sales, Marketing Penjualan, Sales Marketing",SMA/SMK,,https://glints.com/id/opportunities/jobs/sales-store-makassar/f5fd18f9-4e42-4a5e-8805-b85c79b7b2fc?utm_referrer=explore
gl39,Senior Business Analyst,Impact,Business Process Improvement,"Grogol Petamburan, Jakarta Barat, DKI Jakarta, Indonesia",Penuh Waktu,Tidak ditampilkan,Tidak ditampilkan,3 – 5 tahun,"Business Analysis, ERP Implementation, Business Process Improvement, ERP Odoo Project Implementation, Enterprise Resource Planning (ERP), Business Consulting",Sarjana (S1),"Identify the requirement and propose a good alternative solution to client requirement, Collaborate with cross-functional team to design and develop ERP/Odoo apps (new module development, customization), Develop new features and app that users care about, Define features scope, bring a real value to the product, Will be hands-on in ERP project integration, implementation and development",https://glints.com/id/opportunities/jobs/senior-business-analyst/3e69bb77-d672-4e51-b108-2759e1f09363?utm_referrer=explore
gl40,Business Analyst,Impact,Project Management,"Grogol Petamburan, Jakarta Barat, DKI Jakarta, Indonesia",Penuh Waktu,Tidak ditampilkan,Tidak ditampilkan,1 – 3 tahun,Tidak ditampilkan,Sarjana (S1),"Identify the requirement and propose a good alternative solution to client's requirement, Collaborate with cross-functional team to design and develop ERP/Odoo apps (new module development, customization), Develop new features and apps that users care about, Define features scope, bring real value to the product, Will be hands-on in ERP project integration, implementation, and development",https://glints.com/id/opportunities/jobs/business-analyst/37359fa2-3bc3-4641-89b0-3775c7f56996?utm_referrer=explore
