id,Job_title,Company,Working_type,Salary,Experience,Skills,Study_requirement,Descriptions,Link,Link_img
jt146,IT - Hardware Officer,PT Victory Chingluh Indonesia,Tidak ditampilkan,Tidak ditampilkan,Tidak ditampilkan,Tidak ditampilkan,Tidak ditampilkan,"Job Title : IT - Hardware Officer, Job Title : IT - Hardware Officer, , Job Overview, Job Overview, , Carry out maintenance on and supporting computers,networks and telephones so that they can function properly, Carry out maintenance on and supporting computers,networks and telephones so that they can function properly, , Responsibilities and Duties, Responsibilities and Duties, , Installing computer networks, printers, WiFi, telephones and other IT equipment to support company operational processesCarrying out computer troubleshooting to find out what damage has occurred so that it can be repaired immediatelyMaintain and repair printers and other hardware to support smooth work processesInstalling LAN and telephone cables to support work processes in terms of communication in the companyReceive, prioritize, and resolve requests for assistance from users regarding hardware to ensure user needs are metTrain users in using equipment so that errors do not occur in its useMonitor data file usage and manage access to protect information in computer filesBuilding relationships with all departments to create good collaborationMaintain confidentiality of information processed and stored in the system to maintain data confidentialityFollow company program:Comply and Implement of regulations, culture OHS (including use PPE), energy, quality and environment to support company management systemProvide information about work accidents, issues and provide advice related OSH programs, energy, quality and environment to participate and improve the company management system., Installing computer networks, printers, WiFi, telephones and other IT equipment to support company operational processes, Carrying out computer troubleshooting to find out what damage has occurred so that it can be repaired immediately, Maintain and repair printers and other hardware to support smooth work processes, Installing LAN and telephone cables to support work processes in terms of communication in the company, Receive, prioritize, and resolve requests for assistance from users regarding hardware to ensure user needs are met, Train users in using equipment so that errors do not occur in its use, Monitor data file usage and manage access to protect information in computer files, Building relationships with all departments to create good collaboration, Maintain confidentiality of information processed and stored in the system to maintain data confidentiality, Follow company program:, Comply and Implement of regulations, culture OHS (including use PPE), energy, quality and environment to support company management system, Provide information about work accidents, issues and provide advice related OSH programs, energy, quality and environment to participate and improve the company management system., , Requirement, Requirement, , Candidates must be aware about Safety and Health and make it be their priority.Minimum 18 Years OldCandidate must possess at least Bachelor's Degree in Computer Science and Informatics EngineeringAt least 1 year experience in the same fieldKnowledges and Skills:Network computers and LANDamage computersTroubleshooting computer, Network and device IT OthersControl computer and telephone networkPersonality / Character :Delivers Quality, Communicates Effectively, Drive Collaboration, Cultivates innovation, Candidates must be aware about Safety and Health and make it be their priority., Minimum 18 Years Old, Candidate must possess at least Bachelor's Degree in Computer Science and Informatics Engineering, At least 1 year experience in the same field, Knowledges and Skills:, Knowledges and Skills:, Network computers and LAN, Damage computers, Troubleshooting computer, Network and device IT Others, Control computer and telephone network, Personality / Character :Delivers Quality, Communicates Effectively, Drive Collaboration, Cultivates innovation, Personality / Character :, , ""Recruitment Process at PT Victory Chingluh Indonesia NOT CHARGE ANY FEES / FREE"", ""Recruitment Process at PT Victory Chingluh Indonesia NOT CHARGE ANY FEES / FREE"", ",https://www.jobstreet.co.id/id/job/71793109?type=standout&ref=search-standalone,
jt147,Identity & Access Officer,PT PERMODALAN NASIONAL MADANI,Tidak ditampilkan,Tidak ditampilkan,Tidak ditampilkan,Tidak ditampilkan,Tidak ditampilkan,"Qualifications, Bachelor's Degree in Information Technology or related field.2 years working experiences in IT Security, preferable have experience in IT infrastructure data center.Preferred certifications:CEH, CySA, and other relevant Information Security certificates.Have knowledge and familiar with Server/Workstation OS Windows/Linux.Familiar with common security controls.Have experience inActive Directory, Single-Sign-On (SSO), Privilege Access Management, Identity Access Managementis preferable.Good analytical skill, problem solving, interpersonal skill and able to work as a team.Proficient in the preparation of report and documentation., Bachelor's Degree in Information Technology or related field., 2 years working experiences in IT Security, preferable have experience in IT infrastructure data center., Preferred certifications:CEH, CySA, and other relevant Information Security certificates., CEH, CySA, Have knowledge and familiar with Server/Workstation OS Windows/Linux., Familiar with common security controls., Have experience inActive Directory, Single-Sign-On (SSO), Privilege Access Management, Identity Access Managementis preferable., Active Directory, Single-Sign-On (SSO), Privilege Access Management, Identity Access Management, Good analytical skill, problem solving, interpersonal skill and able to work as a team., Proficient in the preparation of report and documentation., ",https://www.jobstreet.co.id/id/job/71704369?type=standout&ref=search-standalone,
jt148,IT Infrastructure Staff (Cengkareng),PT Layanan Keuangan Berbagi,Tidak ditampilkan,Tidak ditampilkan,Tidak ditampilkan,Tidak ditampilkan,Tidak ditampilkan,"Job Descriptions, Job Descriptions, Managing IT Equipment, hardware and all peripheral, such as desktop computer, laptop, modem, printer, photocopy, telephone ectRepairs and maintenance with initial installation of Server and Computer, Laptop or Notebook, and any equipment between printers, monitors, UPS, Fingerprint Hardware, and all tools related to be neededProviding technical support across the Company (this may be in person or over the phone/remotely)Troubleshooting network and system problems, and performance tuningBackup and Restore Management and Recovery OperationsSupport the operation of IT systems, including software and hardware installations, assists users in using applications and software to facilitate the operation, as well as troubleshoot both internal and external applications to support company activitiesEscalate and coordinate network support incidents or requests, Managing IT Equipment, hardware and all peripheral, such as desktop computer, laptop, modem, printer, photocopy, telephone ect, Repairs and maintenance with initial installation of Server and Computer, Laptop or Notebook, and any equipment between printers, monitors, UPS, Fingerprint Hardware, and all tools related to be needed, Providing technical support across the Company (this may be in person or over the phone/remotely), Troubleshooting network and system problems, and performance tuningBackup and Restore Management and Recovery Operations, Support the operation of IT systems, including software and hardware installations, assists users in using applications and software to facilitate the operation, as well as troubleshoot both internal and external applications to support company activities, Escalate and coordinate network support incidents or requests, , Job requirement :, Job requirement :, Minimum Diploma, maximum S1 degree (Information of Technology or other related Major)Fluent in english is a mustHave basic knowledge about ip, tcp, udp, dns, dhcp, routing, vlan, bridge, firewallHave knowledge to configure Vpn IKEv2, l2tp, pptp, MPLS, failover, load balanceHave standard knowledge about ISO 270001Familiar with access point Ubiquiti (Unifi)Computer skill: Microsoft Office (Word, Excel, Power Point)Good communication & Interpersonal SkillGood knowledge on PC desktop application (Windows, Ms. Office, Internet and Email)Able to work effectively in a team environmentHard worker and have a strong responsibilityDynamic, confident, self starter with strong team player spirit, initiative and  results - orientedIn depth knowledge LAN, Wifi, hardware & software troubleshooting, Licensing & troubleshooting OS (windows, MAC, Windows Server, Ubuntu),CCTVWilling to be place in Cengkareng, Minimum Diploma, maximum S1 degree (Information of Technology or other related Major), Fluent in english is a must, Have basic knowledge about ip, tcp, udp, dns, dhcp, routing, vlan, bridge, firewall, Have knowledge to configure Vpn IKEv2, l2tp, pptp, MPLS, failover, load balance, Have standard knowledge about ISO 270001, Familiar with access point Ubiquiti (Unifi), Computer skill: Microsoft Office (Word, Excel, Power Point), Good communication & Interpersonal Skill, Good knowledge on PC desktop application (Windows, Ms. Office, Internet and Email), Able to work effectively in a team environment, Hard worker and have a strong responsibility, Dynamic, confident, self starter with strong team player spirit, initiative and  results - oriented, In depth knowledge LAN, Wifi, hardware & software troubleshooting, Licensing & troubleshooting OS (windows, MAC, Windows Server, Ubuntu),CCTV, Willing to be place in Cengkareng, ",https://www.jobstreet.co.id/id/job/71766396?type=standout&ref=search-standalone,
jt149,Relationship Officer - Penempatan Semarang,PT BCA Finance,Tidak ditampilkan,Tidak ditampilkan,Tidak ditampilkan,Tidak ditampilkan,Tidak ditampilkan,"Tugas Utama :, Tugas Utama :, Memasarkan produk serta memperluas pasar jaringan BCA FinanceMelakukan survey dan analisa data kelayakan konsumenMenjalin relasi dan hubungan baik dengan rekanan BCA Finance, Memasarkan produk serta memperluas pasar jaringan BCA Finance, Melakukan survey dan analisa data kelayakan konsumen, Menjalin relasi dan hubungan baik dengan rekanan BCA Finance, , Kualifikasi :, Kualifikasi :, Usia maksimal 24 tahunPendidikan terakhir D3 / D4 / S1 semua jurusanIPK min. 2,5Memiliki SIM C & sepeda motor pribadiBersedia ditempatkan di cabang BCA Finance Semarang, Usia maksimal 24 tahun, Pendidikan terakhir D3 / D4 / S1 semua jurusan, IPK min. 2,5, Memiliki SIM C & sepeda motor pribadi, Bersedia ditempatkan di cabang BCA Finance Semarang, Bersedia ditempatkan di cabang BCA Finance Semarang, ",https://www.jobstreet.co.id/id/job/71771951?type=standout&ref=search-standalone,
jt150,KASIR - BALI,PT Comextra Majora,Tidak ditampilkan,Tidak ditampilkan,Tidak ditampilkan,Tidak ditampilkan,Tidak ditampilkan,"Tugas dan Tanggung Jawab :, , Menerima pembayaran customer baik secara tunai, transfer, EDC dan pembayaran online lainnyaMemberikan pelayanan yang maksimal bagi customerMembuat laporan penjualanMengatur display produkBertanggung jawab atas kebersihan dan kerapihan toko, Menerima pembayaran customer baik secara tunai, transfer, EDC dan pembayaran online lainnya, Memberikan pelayanan yang maksimal bagi customer, Membuat laporan penjualan, Mengatur display produk, Bertanggung jawab atas kebersihan dan kerapihan toko, , Kualifikasi :, , Usia maksimal 25 tahunPendidikan minimal D3 semua jurusanMemiliki pengalaman kerja sebagai kasir minimal 1 tahunDetail dan telitiMampu menggunakan MS. OfficeKemampuan komunikasi baik dan mampu berbahasa InggrisLokasi kerja : Ruko Jimbaran Blok B & C, Jl. By Pass Ngurah Rai, Usia maksimal 25 tahun, Pendidikan minimal D3 semua jurusan, Memiliki pengalaman kerja sebagai kasir minimal 1 tahun, Detail dan teliti, Mampu menggunakan MS. Office, Kemampuan komunikasi baik dan mampu berbahasa Inggris, Lokasi kerja : Ruko Jimbaran Blok B & C, Jl. By Pass Ngurah Rai, , ",https://www.jobstreet.co.id/id/job/71792362?type=standout&ref=search-standalone,
jt151,Commercial Officer/Supervisor (Berlian Dumai Logistics BALIKPAPAN Placement),PT Buana Lintas Lautan Tbk,Tidak ditampilkan,Tidak ditampilkan,Tidak ditampilkan,Tidak ditampilkan,Tidak ditampilkan,"Requirements:, Requirements:, Bachelor Degree in any majorHas experience at least 3 - 5 years as sales in logistic/forwarder industryFluent in English both oral and writtenRequired Knowledge and Skill(s): logistics knowledge, custom (preferably have custom certificate / Sertifikat Uji Ahli Kepabeanan), export import, filing system, ISO 9001, ISO 14001, ISO 18001Have achievement orientation, customer service orientation, continuous improvement, interpersonal relationship, able to analyze issue and use sound judgment, planning organizing, coordination, work efficiently, negotiation, leveraging network, business process understanding, developing others, team leadership, Bachelor Degree in any major, Has experience at least 3 - 5 years as sales in logistic/forwarder industry, Fluent in English both oral and written, Required Knowledge and Skill(s): logistics knowledge, custom (preferably have custom certificate / Sertifikat Uji Ahli Kepabeanan), export import, filing system, ISO 9001, ISO 14001, ISO 18001, Have achievement orientation, customer service orientation, continuous improvement, interpersonal relationship, able to analyze issue and use sound judgment, planning organizing, coordination, work efficiently, negotiation, leveraging network, business process understanding, developing others, team leadership, , Responsibilities:, Responsibilities:, Ensuring end to end project and commercial activities are well arranged and run smoothly.Ensuring all documentations are well prepared prior project and commercial.Ensuring new project / market are identified and developed.Ensuring strategic business plan are created.Ensuring good company reputation and relation with all related business network are maintained.Planning annual budgetPlanning & monitoring commercial target in the running yearMonitoring revenue achievementExploring possibilities of new businessLooking for the new projectPreparing summary for new project informationAnalyzing Market and seasonal business to create business planCreating one package for cargo shipmentCalculating rate for customer neededInquiring customer need to prepare liner service, rate, transit time, and other supporting provider like trucking & warehousingDevelop new business for container and other logistics work also maintain existing customerKnows your customer and competitorKeep close relation with vendors like liners, trucking, fumigator and other related departmentManage Performance Work to perform lifting and revenueEvaluate Work to perform customer satisfaction for repeat order, Ensuring end to end project and commercial activities are well arranged and run smoothly., Ensuring all documentations are well prepared prior project and commercial., Ensuring new project / market are identified and developed., Ensuring strategic business plan are created., Ensuring good company reputation and relation with all related business network are maintained., Planning annual budget, Planning & monitoring commercial target in the running year, Monitoring revenue achievement, Exploring possibilities of new business, Looking for the new project, Preparing summary for new project information, Analyzing Market and seasonal business to create business plan, Creating one package for cargo shipment, Calculating rate for customer needed, Inquiring customer need to prepare liner service, rate, transit time, and other supporting provider like trucking & warehousing, Develop new business for container and other logistics work also maintain existing customer, Knows your customer and competitor, Keep close relation with vendors like liners, trucking, fumigator and other related department, Manage Performance Work to perform lifting and revenue, Evaluate Work to perform customer satisfaction for repeat order, , Note:, Note:, The recruitment & selection process is not going to charge any payment from candidates. Be careful with another parties on behalf our company that need you to pay some amount of money or another parties that inform that we have collaboration with travel agent. We do not have any collaboration with any travel agent., ",https://www.jobstreet.co.id/id/job/71792019?type=standard&ref=search-standalone,
jt152,Custom Formalities Staff (Berlian Dumai Logistics SURABAYA Placement),PT Buana Lintas Lautan Tbk,Tidak ditampilkan,Tidak ditampilkan,Tidak ditampilkan,Tidak ditampilkan,Tidak ditampilkan,"Requirements:, Requirements:, Minimum Diploma 3 in any majorMinimum 1 year experience in similar positionFluent in English both oral and writtenRequired Knowledge and Skill(s): logistic knowledge, customs/export-import (preferably have custom certificate / Sertifikat Uji Ahli Kepabeanan), able to manage PEB & PIB modules, computer literate (Ms. Word, Excel, PowerPoint), filing system, ISO 9001, ISO 14001, & ISO 45001Have achievement orientation, customer service orientation, continuous improvement, interpersonal relationship, able to analyze issue and use sound judgment, planning organizing, concern for order, coordination, work efficiently, negotiation, business process understanding, team work, Minimum Diploma 3 in any major, Minimum 1 year experience in similar position, Fluent in English both oral and written, Required Knowledge and Skill(s): logistic knowledge, customs/export-import (preferably have custom certificate / Sertifikat Uji Ahli Kepabeanan), able to manage PEB & PIB modules, computer literate (Ms. Word, Excel, PowerPoint), filing system, ISO 9001, ISO 14001, & ISO 45001, Have achievement orientation, customer service orientation, continuous improvement, interpersonal relationship, able to analyze issue and use sound judgment, planning organizing, concern for order, coordination, work efficiently, negotiation, business process understanding, team work, , Responsibilities:, Responsibilities:, Ensuring end to end process of custom’s documents are well arrangedEnsuring all cargoes received well in consignee handEnsuring all cargoes delivered well from shipperCustom modul data entry, make necessary contact & coordination with internal and external customer, and others (shipping, general forwarder)Making PEB/PIB and documents related to export-importDaily Communicating with customers and overseas partners.Handle all documents for export / import processManage daily document EXIM, execute data make sure completed.Sharing schedule stuffing & monitoring the stuffing process with the operational team, Ensuring end to end process of custom’s documents are well arranged, Ensuring all cargoes received well in consignee hand, Ensuring all cargoes delivered well from shipper, Custom modul data entry, make necessary contact & coordination with internal and external customer, and others (shipping, general forwarder), Making PEB/PIB and documents related to export-import, Daily Communicating with customers and overseas partners., Handle all documents for export / import process, Manage daily document EXIM, execute data make sure completed., Sharing schedule stuffing & monitoring the stuffing process with the operational team, , Note:, Note:, The recruitment & selection process is not going to charge any payment from candidates. Be careful with another parties on behalf our company that need you to pay some amount of money or another parties that inform that we have collaboration with travel agent. We do not have any collaboration with any travel agent., ",https://www.jobstreet.co.id/id/job/71792124?type=standard&ref=search-standalone,
jt153,Quality Food Safety Intern (Bali - Magang),Danone Indonesia,Tidak ditampilkan,Tidak ditampilkan,Tidak ditampilkan,Tidak ditampilkan,Tidak ditampilkan,"Danone Indonesia is looking for Quality and Food Safety Intern for placement in Bali. In this role you will help the Quality and Food Safety team to update food safety SOP, training preparation, and risk assessment. The requirements for this role are:, Undergraduates from chemical engineering, industrial engineering, biology, food technology, chemistry, or any relevant majorsFluent in English both oral and written.Able and familiar to operate AutoCAD, Ms. Visio, and Canva or other editing applicationHave basic knowledge related to the microbiology/chemical/food technology/HACCP is favorable., Undergraduates from chemical engineering, industrial engineering, biology, food technology, chemistry, or any relevant majors, Fluent in English both oral and written., Able and familiar to operate AutoCAD, Ms. Visio, and Canva or other editing application, Have basic knowledge related to the microbiology/chemical/food technology/HACCP is favorable., ",https://www.jobstreet.co.id/id/job/71787431?type=standout&ref=search-standalone,
jt154,Creative & Brand Strategist Head,PT Rusli Vinilon Sakti,Tidak ditampilkan,Tidak ditampilkan,Tidak ditampilkan,Tidak ditampilkan,Tidak ditampilkan,"Tugas dan Tanggung Jawab :, Tugas dan Tanggung Jawab :, Merancang dan mengembangkan ide promotional item dan content sebagai bahan promosiMembuat design material yang komunikatif, menarik, dan mudah dipahami terkait dengan promotional itemMelakukan quality control content termasuk teks, warna,design, dan elemen lainnya pada collateral, iklan, dan materi lainnya sesuai dengan objective marketing dan brand guideline yang berlaku.Mengikuti dan memahami perkembangan design language sesuai dengan trend terbaru untuk membangun branding VinilonMemahami, merancang, dan mengembangkan bentuk dan produk dari promotional item sesuai dengan trend terbaru untuk membangun branding Vinilon, Merancang dan mengembangkan ide promotional item dan content sebagai bahan promosi, Membuat design material yang komunikatif, menarik, dan mudah dipahami terkait dengan promotional item, Melakukan quality control content termasuk teks, warna,design, dan elemen lainnya pada collateral, iklan, dan materi lainnya sesuai dengan objective marketing dan brand guideline yang berlaku., Mengikuti dan memahami perkembangan design language sesuai dengan trend terbaru untuk membangun branding Vinilon, Memahami, merancang, dan mengembangkan bentuk dan produk dari promotional item sesuai dengan trend terbaru untuk membangun branding Vinilon, Kualifikasi :, Kualifikasi :, Minimal S1 diutamakan jurusan DKV, Art & DesignMinimal Pengalaman 3 tahun di bidang yang sama (Brand Specialist / Strategists, Creative / Sosmed Specialist & KOL Specialist)Paham Motion Graphic, Photoshop, adobe illustrator, dreamweaver, etcMengerti tentang Editting, Color Correction, Layout Design, Social Media ContentPenempatan Raden Saleh, Jakarta Pusat, Minimal S1 diutamakan jurusan DKV, Art & Design, Minimal Pengalaman 3 tahun di bidang yang sama (Brand Specialist / Strategists, Creative / Sosmed Specialist & KOL Specialist), Paham Motion Graphic, Photoshop, adobe illustrator, dreamweaver, etc, Mengerti tentang Editting, Color Correction, Layout Design, Social Media Content, Penempatan Raden Saleh, Jakarta Pusat, ",https://www.jobstreet.co.id/id/job/71764024?type=standout&ref=search-standalone,
jt155,"Customer Service - Operations (Jogja, Contract-based)",Shopee Internasional Indonesia,Tidak ditampilkan,Tidak ditampilkan,Tidak ditampilkan,Tidak ditampilkan,Tidak ditampilkan,"Requirements, Requirements, Minimum diploma or bachelor's degree from any major0-1 year experience in Customer Service (Fresh graduate are welcome to apply)Strong communication skills & customer-oriented, a team player, have a positive attitude, and an eagerness to learnHave good logical thinking and problem-solving skillsSelf-driven and motivatedWilling to work in shifts and has a big interest in working in an e-commerce companyPlacement is in Yogyakarta for 6 months contract based, Minimum diploma or bachelor's degree from any major, 0-1 year experience in Customer Service (Fresh graduate are welcome to apply), Strong communication skills & customer-oriented, a team player, have a positive attitude, and an eagerness to learn, Have good logical thinking and problem-solving skills, Self-driven and motivated, Willing to work in shifts and has a big interest in working in an e-commerce company, Placement is in Yogyakarta for 6 months contract based, , Job Description, Job Description, Handle customer inquiries from sellers and buyers through calls, email, and other platformManage and resolve customer-related issues and escalationsBe the voice of customers to provide feedback to the companyAnalyze customer experience reports and insights and come up with improvement suggestions and initiatives, Handle customer inquiries from sellers and buyers through calls, email, and other platform, Manage and resolve customer-related issues and escalations, Be the voice of customers to provide feedback to the company, Analyze customer experience reports and insights and come up with improvement suggestions and initiatives, ",https://www.jobstreet.co.id/id/job/71751077?type=standard&ref=search-standalone,
