id,Job_title,Company,Working_type,Salary,Experience,Skills,Study_requirement,Descriptions,Link,Link_img
jt222,Sales Engineer,Johnson Controls,Tidak ditampilkan,Tidak ditampilkan,Tidak ditampilkan,Tidak ditampilkan,Tidak ditampilkan,"Who we are:, Who we are:, Build your best future with the Johnson Controls team, As a global leader in smart, healthy and sustainable buildings, our mission is to reimagine the performance of buildings to serve people, places and the planet. Join a winning team that enables you to build your best future! Our teams are uniquely positioned to support a multitude of industries across the globe. You will have the opportunity to develop yourself through meaningful work projects and learning opportunities. We strive to provide our employees with an experience, focused on supporting their physical, financial, and emotional wellbeing. Become a member of the Johnson Controls family and thrive in an empowering company culture where your voice and ideas will be heard – your next great opportunity is just a few clicks away!, , What you will do:, What you will do:, As a Sales Engineer, you will be responsible to manage the sales of our Controls, Fire and Security unit, acquire new customers mainly within Data Center market, build relationship with customers, understand the customer need and offers solutions based on their requirements., , How you will do it:, How you will do it:, Work with Controls, Fire, & Security (CFS) support group in the Country and in the Region for System and Products in providing distinctive sales support, system design and system solutions to satisfy customers’ needs.Develop Individual Sales plans and manage individual yearly pipeline in the assigned market segment.Execute the initiatives and committing to yield total customer satisfaction and achieve the business results.Meet Key Performance Indicators (KPIs) set for his business segment within the CFS sales department.Maintain existing customer base and develop new customer base to ensure continuous business growthMaintain constant field intelligence and feedback pertinent information on competitors activities, product, prices, business performance and promotional programsCommunicate and work closely with other departments in ensuring the overall company objectives/performance is achieved at all times.Manage the Secured Win projects diligently in term of costing, timely planning of delivery schedule with the Operations department and/or Service department, minimize additional rework or unplanned cost.Foster strong relationship with customers and suppliers/vendors, enabling the company is at active & leading, speedy response time, highly profitable, excellent payment collection position at all time.Perform any other duties from time to time, whether ad-hoc or otherwise, as assigned by his superiorMaintain high morale and team spirit within the team, Work with Controls, Fire, & Security (CFS) support group in the Country and in the Region for System and Products in providing distinctive sales support, system design and system solutions to satisfy customers’ needs., Develop Individual Sales plans and manage individual yearly pipeline in the assigned market segment., Execute the initiatives and committing to yield total customer satisfaction and achieve the business results., Meet Key Performance Indicators (KPIs) set for his business segment within the CFS sales department., Maintain existing customer base and develop new customer base to ensure continuous business growth, Maintain constant field intelligence and feedback pertinent information on competitors activities, product, prices, business performance and promotional programs, Communicate and work closely with other departments in ensuring the overall company objectives/performance is achieved at all times., Manage the Secured Win projects diligently in term of costing, timely planning of delivery schedule with the Operations department and/or Service department, minimize additional rework or unplanned cost., Foster strong relationship with customers and suppliers/vendors, enabling the company is at active & leading, speedy response time, highly profitable, excellent payment collection position at all time., Perform any other duties from time to time, whether ad-hoc or otherwise, as assigned by his superior, Maintain high morale and team spirit within the team, , What we look for:, What we look for:, Above 5-years working experience as sales/marketing position in direct selling for CFS (Controls, Fire & Security) solutions in construction/building market.Self-motivated, work based on target and under less supervision.Sales & distribution development (preferable CFS at construction Market & having customer base)Able to forecast pricing, quotation & budgeting.Good negotiation, communication, analytical, aggressive & relationship management skillsMust be a proactive team player & having problem solving spiritsProficiency in English (written & oral)Computer literate (MS-Excel, MS-Word, CAD is an advantage).Possess a car would be an advantage., Above 5-years working experience as sales/marketing position in direct selling for CFS (Controls, Fire & Security) solutions in construction/building market., Self-motivated, work based on target and under less supervision., Sales & distribution development (preferable CFS at construction Market & having customer base), Able to forecast pricing, quotation & budgeting., Good negotiation, communication, analytical, aggressive & relationship management skills, Must be a proactive team player & having problem solving spirits, Proficiency in English (written & oral), Computer literate (MS-Excel, MS-Word, CAD is an advantage)., Possess a car would be an advantage., , What we offer:, What we offer:, Competitive salaryPaid vacation/holidays/sick timeComprehensive benefits packageOn the job/cross training opportunitiesEncouraging and collaborative team environmentDedication to safety through our Zero Harm policy, Competitive salary, Paid vacation/holidays/sick time, Comprehensive benefits package, On the job/cross training opportunities, Encouraging and collaborative team environment, Dedication to safety through our Zero Harm policy, , #LI-NR1, #LI-Onsite, , , , , , ",https://www.jobstreet.co.id/id/job/71786789?type=standout&ref=search-standalone,
jt223,Customer Relation Coordinator (Area Jabodetabek & Bandung),PT Plaza Auto Raya,Tidak ditampilkan,Tidak ditampilkan,Tidak ditampilkan,Tidak ditampilkan,Tidak ditampilkan,"Job descriptions:, Job descriptions, Memastikan seluruh standar layanan di cabang dijalankan dengan baikMemastikan seluruh karyawan di cabang untuk menerapkan standar grooming dan service excellentSebagai pusat suara pelanggan serta memastikan program di cabang terlaksanaMemastikan seluruh karyawan di cabang untuk menerapkan standar grooming dan service excellentMenjaga validitas data pelanggan, Memastikan seluruh standar layanan di cabang dijalankan dengan baik, Memastikan seluruh karyawan di cabang untuk menerapkan standar grooming dan service excellent, Sebagai pusat suara pelanggan serta memastikan program di cabang terlaksana, Memastikan seluruh karyawan di cabang untuk menerapkan standar grooming dan service excellent, Menjaga validitas data pelanggan, , Job qualifications:, Job qualifications, Kandidat wajib lulusan S1 dari lulusan manapun (Jurusan Ilmu Komunikasi lebih diutamakan) dengan minimal IPK 3.00Memiliki komunikasi yang baikBerpengalaman di area Customer Service atau dibidang yang sama lebih diutamakanMaksimal berusia 28 tahunBersedia penempatan di area Jabodetabek dan Bandung., Kandidat wajib lulusan S1 dari lulusan manapun (Jurusan Ilmu Komunikasi lebih diutamakan) dengan minimal IPK 3.00, Memiliki komunikasi yang baik, Berpengalaman di area Customer Service atau dibidang yang sama lebih diutamakan, Maksimal berusia 28 tahun, Bersedia penempatan di area Jabodetabek dan Bandung., ",https://www.jobstreet.co.id/id/job/71771552?type=standout&ref=search-standalone,
jt224,Staff Technical Support,PT Star Cosmos,Tidak ditampilkan,Tidak ditampilkan,Tidak ditampilkan,Tidak ditampilkan,Tidak ditampilkan,"Deskripsi Pekerjaan:, Deskripsi Pekerjaan:, Analisa/ verifikasi masalah2 yg dominan pada barang Service dan report ke team Pabrik (R/D/ PED/ QC/ Produksi) untuk dilakukan ImprovementMenerima dan menjawab komplaint/pertanyaan konsumen terkait masalah pada produkKordinasi dengan Supervisor TS untuk proses permintaan (PBB) Tool teknisi dan distribusi ke PL SVCMenerima dan menjawab komplain dan pertanyaan konsumenMonitoring input Data Symp Defect yg tidak sesuai di all PL SVCMemeriksa updated perubahan Part List dan Exploded Drawing yg diinformasikan dr R&DMembuat dan updated Record PBB untuk di Follow up ke PurchaseMelakukan Test Praktek Apps (CASM Service dan CASM Employee) dan mengajukan akses live CASM ke IT untuk teknisi baruMenerima Barang /tool yg dikirim dari Supplier, Proses MIGO dan pengajuan no Aset ke PurchaseMaintain Stock dan SO Tool dan Aset di Teknikal SupportMelakukan review terhadap kinerja teknisi di all PL Service, Analisa/ verifikasi masalah2 yg dominan pada barang Service dan report ke team Pabrik (R/D/ PED/ QC/ Produksi) untuk dilakukan Improvement, Menerima dan menjawab komplaint/pertanyaan konsumen terkait masalah pada produk, Kordinasi dengan Supervisor TS untuk proses permintaan (PBB) Tool teknisi dan distribusi ke PL SVC, Menerima dan menjawab komplain dan pertanyaan konsumen, Monitoring input Data Symp Defect yg tidak sesuai di all PL SVC, Memeriksa updated perubahan Part List dan Exploded Drawing yg diinformasikan dr R&D, Membuat dan updated Record PBB untuk di Follow up ke Purchase, Melakukan Test Praktek Apps (CASM Service dan CASM Employee) dan mengajukan akses live CASM ke IT untuk teknisi baru, Menerima Barang /tool yg dikirim dari Supplier, Proses MIGO dan pengajuan no Aset ke Purchase, Maintain Stock dan SO Tool dan Aset di Teknikal Support, Melakukan review terhadap kinerja teknisi di all PL Service, , Kualifikasi :, Kualifikasi :, Pendidikan minimal D3/S1 jurusanTeknik Elektro / Teknik MesinPengalaman minimal 1 tahun di Produksi/Engineering/serviceMemiliki kemampuan komunikasi yang baikMemiliki pengetahuan terkait service elektronikBisa menggunkan Ms. Office (word, excel, power point), Autocad, Corell Draw, dllHari kerja: Senin-sabtuPenempatan : Kebon Besar, Tangerang, Pendidikan minimal D3/S1 jurusanTeknik Elektro / Teknik Mesin, Pengalaman minimal 1 tahun di Produksi/Engineering/service, Memiliki kemampuan komunikasi yang baik, Memiliki pengetahuan terkait service elektronik, Bisa menggunkan Ms. Office (word, excel, power point), Autocad, Corell Draw, dll, Hari kerja: Senin-sabtu, Penempatan : Kebon Besar, Tangerang, , ",https://www.jobstreet.co.id/id/job/71779567?type=standard&ref=search-standalone,
jt225,Supervisor HRD,CV. Filo Group,Tidak ditampilkan,Rp 5.000.000 – Rp 7.000.000 per month,Tidak ditampilkan,Tidak ditampilkan,Tidak ditampilkan,"WE ARE HIRING!, WE ARE HIRING!, Position : Supervisor HR (Full Time - WFO), Position : Supervisor HR (Full Time - WFO), Location : Klaten, Jawa Tengah, Location : Klaten, Jawa Tengah, Filo Group is a digital marketing company that provides several brands such as Calamby, Lovelo & Fujinka. We believe that every wom*an deserves to look & feel fabulous, therefore We would like to support every wom*an to be more confident, beautiful & healthier through our product., Filo Group is a digital marketing company that provides several brands such as Calamby, Lovelo & Fujinka. We believe that every wom*an deserves to look & feel fabulous, therefore We would like to support every wom*an to be more confident, beautiful & healthier through our product., We are looking for a candidate who  is willing to maximize their potential and grow up with our company., We are looking for a candidate who  is willing to maximize their potential and grow up with our company., , Supervisor Human Resources, Supervisor Human Resources, Job Qualification :, Job Qualification :, Minimum Bachelor Degree in Psychology or related fieldExperienced as HR leader minimum 2 yearsMaximum is 30 years old4-5 years working experiences as HRGood public speaking & interpersonal skillExperienced in recruiting, payroll & people developmentAdvanced in administrative skills, legal (UU Ketenagakerjaan, PKWT, PKWTT)Ability to manage & implement performance appraisal, Minimum Bachelor Degree in Psychology or related field, Minimum Bachelor Degree in Psychology or related field, Experienced as HR leader minimum 2 years, Experienced as HR leader minimum 2 years, Maximum is 30 years old, Maximum is 30 years old, 4-5 years working experiences as HR, 4-5 years working experiences as HR, Good public speaking & interpersonal skill, Good public speaking & interpersonal skill, Experienced in recruiting, payroll & people development, Experienced in recruiting, payroll & people development, Advanced in administrative skills, legal (UU Ketenagakerjaan, PKWT, PKWTT), Advanced in administrative skills, legal (UU Ketenagakerjaan, PKWT, PKWTT), Ability to manage & implement performance appraisal, Ability to manage & implement performance appraisal, Job Description:, Job Description:, Handle end to end recruitment & selectionCreate & manage employee & company development programHandle, manage & maintain all administrative process in HRSupervise day to day HR activitiesControlling & conduct performance appraisalCreate internalization value program, Handle end to end recruitment & selection, Handle end to end recruitment & selection, Create & manage employee & company development program, Create & manage employee & company development program, Handle, manage & maintain all administrative process in HR, Handle, manage & maintain all administrative process in HR, Supervise day to day HR activities, Supervise day to day HR activities, Controlling & conduct performance appraisal, Controlling & conduct performance appraisal, Create internalization value program, Create internalization value program, What will you get ?, What will you get ?, Competitive WagesDiscount new productHealth SupportBonus PerformaSupport training & upgrade knowledgeReward for special moment, Competitive Wages, Competitive Wages, Discount new product, Discount new product, Health Support, Health Support, Bonus Performa, Bonus Performa, Support training & upgrade knowledge, Support training & upgrade knowledge, Reward for special moment, Reward for special moment, , We are waiting for your consideration to join our company., We are waiting for your consideration to join our company., See you on board!, See you on board!, ",https://www.jobstreet.co.id/id/job/71732203?type=standout&ref=search-standalone,
jt226,ADMINISTRATION STAFF,PT. POLARIS ALKES STARINDO,Tidak ditampilkan,"Rp 5,000,000 – Rp 7,000,000 per month",Tidak ditampilkan,Tidak ditampilkan,Tidak ditampilkan,"ADMINISTRATION STAFF, ADMINISTRATION STAFF, , Kualifikasi:, Kualifikasi, Usia maksimal. 35 tahunMinimal. D3 / S1 semua jurusanFresh graduate / minimal 1 tahun bekerja sebagai Administration Staff di perusahaan distributor alat kesehatanMenguasai Ms. Office & WordTeliti dan rapi dalam administrasiMampu berkomunikasi dengan baikCepat Belajar, disiplin dan bertanggung jawabMampu bekerja dalam tim dan dibawah tekananPenempatan : Jakarta Pusat, Usia maksimal. 35 tahun, Minimal. D3 / S1 semua jurusan, Fresh graduate / minimal 1 tahun bekerja sebagai Administration Staff di perusahaan distributor alat kesehatan, Menguasai Ms. Office & Word, Teliti dan rapi dalam administrasi, Mampu berkomunikasi dengan baik, Cepat Belajar, disiplin dan bertanggung jawab, Mampu bekerja dalam tim dan dibawah tekanan, Penempatan : Jakarta Pusat, , Tanggung Jawab:, Tanggung Jawab, Memeriksa dan memproses setiap pesanan baik melalui e-katalog, LPSE, maupun pembelian secara langsung.Membuat order confirmation dan sales order kemudian mendistribusikannya kepada divisi terkait.Memproses dokumen dan menyelesaikan berkas Surat Pesanan (SP) / Surat Perintah Kerja (SPK) / kontrak / berita acara yang telah diterima sebagai dasar penagihan kepada pelanggan.Membuat rekapitulasi laporan transaksi penjualan harian.Melakukan follow up dan berkoordinasi dengan sales atau pelanggan terkait permintaan berkas / dokumen administrasi yang belum diterima perusahaan.Melakukan arsip data / filling berkas seluruh pesanan maupun dokumen administrasi yang berkaitan dengan penjualan.Melakukan serah terima dokumen administrasi (SP / SPK / Kontrak / Berita Acara) kepada divisi Finance, Accounting, & Tax., Memeriksa dan memproses setiap pesanan baik melalui e-katalog, LPSE, maupun pembelian secara langsung., Membuat order confirmation dan sales order kemudian mendistribusikannya kepada divisi terkait., Memproses dokumen dan menyelesaikan berkas Surat Pesanan (SP) / Surat Perintah Kerja (SPK) / kontrak / berita acara yang telah diterima sebagai dasar penagihan kepada pelanggan., Membuat rekapitulasi laporan transaksi penjualan harian., Melakukan follow up dan berkoordinasi dengan sales atau pelanggan terkait permintaan berkas / dokumen administrasi yang belum diterima perusahaan., Melakukan arsip data / filling berkas seluruh pesanan maupun dokumen administrasi yang berkaitan dengan penjualan., Melakukan serah terima dokumen administrasi (SP / SPK / Kontrak / Berita Acara) kepada divisi Finance, Accounting, & Tax., ",https://www.jobstreet.co.id/id/job/71735323?type=standout&ref=search-standalone,
jt227,Administration Staff Customer Service,The Boogaloo Bali,Tidak ditampilkan,"Rp 3,500,000 – Rp 5,000,000 per month",Tidak ditampilkan,Tidak ditampilkan,Tidak ditampilkan,"Job Title:Administrative Assistant - Customer Service and Inventory Management, Job Title:, Job Location:Kerobokan, Bali, Job Location:, Job Type:Full-Time, Job Type:, About the Role:We are seeking a highly organized and customer-focused Administrative Assistant to join our team. This role is critical in providing exceptional customer service and efficiently managing inventory for our online stores., About the Role:, Key Responsibilities:, Key Responsibilities:, Customer Service:, Customer Service:, Respond promptly to customer inquiries via phone, email, or chat.Resolve customer issues and complaints with a professional approach.Maintain high customer satisfaction levels by providing accurate information and timely support.Liaise with other staff members to ensure customer needs are met., Respond promptly to customer inquiries via phone, email, or chat., Resolve customer issues and complaints with a professional approach., Maintain high customer satisfaction levels by providing accurate information and timely support., Liaise with other staff members to ensure customer needs are met., Inventory Management:, Inventory Management:, Receive and inspect incoming merchandise, ensuring accuracy and quality.Input product details into the online store's database, including descriptions, prices, and stock levels.Coordinate with the office team to manage inventory storage and organization.Perform regular inventory audits and update the system accordingly., Receive and inspect incoming merchandise, ensuring accuracy and quality., Input product details into the online store's database, including descriptions, prices, and stock levels., Coordinate with the office team to manage inventory storage and organization., Perform regular inventory audits and update the system accordingly., Administrative Support:, Administrative Support:, Assist in processing orders, including order entry and tracking.Prepare reports on customer interactions and inventory status as required.Provide general administrative support such as filing, photocopying, and maintaining office supplies.Collaborate with the team to improve internal processes for better efficiency., Assist in processing orders, including order entry and tracking., Prepare reports on customer interactions and inventory status as required., Provide general administrative support such as filing, photocopying, and maintaining office supplies., Collaborate with the team to improve internal processes for better efficiency., Qualifications:, Qualifications:, High school diploma or equivalent; further education or certification in office administration or relevant field is a plus.Proven experience in customer service and/or administrative roles.Strong organizational and multitasking abilities.Excellent communication skills, both verbal and written.Proficient in MS Office, Wordpress, Tokopedia and familiar with database management.Ability to work independently and as part of a team.Attention to detail and problem-solving skills., High school diploma or equivalent; further education or certification in office administration or relevant field is a plus., Proven experience in customer service and/or administrative roles., Strong organizational and multitasking abilities., Excellent communication skills, both verbal and written., Proficient in MS Office, Wordpress, Tokopedia and familiar with database management., Ability to work independently and as part of a team., Attention to detail and problem-solving skills., What We Offer:, What We Offer:, Competitive salary and benefits package.A supportive and dynamic work environment.Opportunities for professional growth and development., Competitive salary and benefits package., A supportive and dynamic work environment., Opportunities for professional growth and development., , ",https://www.jobstreet.co.id/id/job/71730843?type=standard&ref=search-standalone,
jt228,PSA Sales Engineer,Johnson Controls,Tidak ditampilkan,Tidak ditampilkan,Tidak ditampilkan,Tidak ditampilkan,Tidak ditampilkan,"What you will do:, What you will do:, You will be responsible to secure & WIN Planned Service Agreement (PSA) businesses for Johnson Controls’ Business Units (BU), perform PSA Sales & Marketing scheduled visitation to new and existing PSA clients, maximizing business profitability, and provide consultation i.e. helping non-PSA customers (within the scope of Johnson Controls’ expertise) to explore any possibility to engage with Johnson Control., , How you will do it:, How you will do it:, Plan scheduled visitation to new and existing PSA clientsEstablishing and cultivating long term business relationships by understanding and anticipating customer needs & priorities and delivering effective solutions via feedback to operations.To diligently convert the existing Installed Base (IB) in order to improve the Linkage Ratio for Johnson Controls’ Business Units (BU)To achieve financial goal set for each PSA., Plan scheduled visitation to new and existing PSA clients, Establishing and cultivating long term business relationships by understanding and anticipating customer needs & priorities and delivering effective solutions via feedback to operations., To diligently convert the existing Installed Base (IB) in order to improve the Linkage Ratio for Johnson Controls’ Business Units (BU), To achieve financial goal set for each PSA., , What we look for:, What we look for:, Bachelor’s Degree in any business-related discipline / Bachelor of Science / Bachelor of Engineering in any of the following Electrical / Electronics / Mechanical/Sales Marketing field.Basic knowledge in Air-conditioner and/or BAS / CCTV / Fire Fighting / Fire Alarm / Card Access Security System /Facility Management / O&M would be added advantage.2 to 5 years’ experience in sales or sales management experience with technical oriented sales.Demonstrated knowledge of industry and company products and services.Evaluates existing market coverage and opportunity and develops plans for each channel to maximize sales.Computer literate, preferably knowledge in MS Word and Excel.Fluent in written and spoken English, Bachelor’s Degree in any business-related discipline / Bachelor of Science / Bachelor of Engineering in any of the following Electrical / Electronics / Mechanical/Sales Marketing field., Basic knowledge in Air-conditioner and/or BAS / CCTV / Fire Fighting / Fire Alarm / Card Access Security System /Facility Management / O&M would be added advantage., 2 to 5 years’ experience in sales or sales management experience with technical oriented sales., Demonstrated knowledge of industry and company products and services., Evaluates existing market coverage and opportunity and develops plans for each channel to maximize sales., Computer literate, preferably knowledge in MS Word and Excel., Fluent in written and spoken English, , What we offer:, What we offer:, Competitive salaryPaid vacation/holidays/sick timeComprehensive benefits packageOn the job/cross training opportunitiesEncouraging and collaborative team environmentDedication to safety through our Zero Harm policy, Competitive salary, Paid vacation/holidays/sick time, Comprehensive benefits package, On the job/cross training opportunities, Encouraging and collaborative team environment, Dedication to safety through our Zero Harm policy, ",https://www.jobstreet.co.id/id/job/71785349?type=standout&ref=search-standalone,
